image,short_prompt
3e0d310d8fe974e81db8b1c37c64e8e8.png,"A realistic digital artwork: Woman in a gray sweater, curly hair, focused portrait with soft blurred greens."
c021c902576c1274a8207a6e68ed2e0e.png,"A floral symphony: Woman & horse adorned in ethereal flowers, gaze upon us."
89d95ae9ad67d25b47511141fae10c41.png,"A crisp close-up of a determined woman with intense eyes gazing directly ahead, set in a blurry snowy urban landscape."
520766318b38aa7ac473c9beac0c974e.png,"An ethereal, starry cosmos of vibrant geometric foxes."
62de7f14915e0e9139da45226e2159a7.png,"An oil painting of an astronaut's portrait with an aquatic twist, featuring a detailed easel setup."
4ce241c50f3420ca47b27ba6a83ee8a4.png,A close-up portrait: bold red-haired woman with a braided hairstyle and intricate leather jacket.
e54fcbebebfbaa4d9df79b7b3f7ffc1c.png,"An illustration of a green-eyed white cat, serious and focused, seated on a beige background."
184fe8340b19b430d7fd47e5e756115a.png,"A vibrant urban portrait: a young woman adorned with a red head scarf, gazing directly at the viewer with striking blue eyes, set against a blurred chain link fence."
4198e6b4e155362063aaed87d169cd65.png,"A portrait of a blonde woman, her mind among the stars, against a dark blue celestial canvas."
003cafad79558ded63cc7e763690c569.png,"A serene portrait: Centered young woman with cascading dark hair, peaceful expression, white shirt, stark against dark background."
496ec9eccdc4c2f2a15afe3436ec9a18.png,"An ethereal illustration of a tiger, adorned with celestial patterns, amidst a fiery orange and yellow blaze."
dccb2143c6b884ecb03b7188fc113563.png,"An ethereal, surreal painting: vibrant orange waterfall frozen against dark gray cliffs."
9234b6d0a1e11fc355f35a90140390f2.png,An illustrated close-up of a surprised orange cat in a blue hoodie on a gray background.
42ab9c3f3935b3f521d3cc6979132a72.png,"A portrait of a young woman, focused on music, adorned with a vibrant scarf, and capturing a connection through direct gaze."
1edcbee316e3c100fdd021dc49d463d4.png,"An illustration of a vibrant blue parrot, wings spread on a white canvas."
4b3cb469473cd187f2ba865764838621.png,"A harmonious circle of soft fur and patterns, rabbits and guinea pigs in a tranquil moment."
36b4a955f92b879b1bbc6b0b87f0c9e8.png,An animated rendering of Mickey Mouse kicking a soccer ball against the Moon's surface.
5d2ccfd2ad6d5ead40a8d93aa3c4c239.png,A captivating snapshot: Rabbit amidst a vibrant floral symphony.
912f7206b70e2112920999b643fe4770.png,"An epic, serene illustration: A black and red armored samurai, poised in snow."
e606dbf1f7a0793e819d66041857538f.png,"A moody digital illustration of a solitary spider, its vibrant orange eyes the sole light source, casting an ethereal glow against a dark rocky backdrop."
9a1a53446834f0b725f265b6d2624da1.png,A detailed and intricate glass sculpture capturing the interplay of fire and ice.
62066d7bb6855d3d5702319713c0cd84.png,"A black backdrop highlights the ethereal beauty of a single, curved pink petaled flower, asymmetrically positioned."
d85e1183c05f69dc64111133d136860f.png,A black and white close up of a mysterious woman with silver hair and bold jewelry.
18db4282028ef1f0148db29a35dcb1b2.png,"A decadent, reflected dessert masterpiece."
c92a7e002d8a26956b9215bc01260001.png,"An ethereal, Gothic cathedral, a fiery portal, and a shrouded figure stand in contrast."
29c369710466b14abcfb4109afc2caac.png,"An ethereal forest sunset, the vibrant sky and silhouettes of towering trees a majestic sight."
46e32b4bf0474d20d4df484f06cd6394.png,"An expansive sunset sky, a bright orange sun at its center, encircled by red and orange, is the focal point of this serene scene. Tall palm tree silhouettes stand in contrast, a humble tribute to the majestic sky, while tiny birds add life and scale."
228d1d0d93eac96e1b1308c3e4abdf59.png,"A majestic, golden female figure against a stark black background."
1b79010c3c30e2dca37c6cc164502db0.png,"An orange-haired dandy in a pink backdrop, lost in thought, exuding confidence."
0a0550eab63dc94508e59e0a98b13cee.png,"A futuristic pastel cityscape, a black dog lost in thought on a windowsill."
1af82da7d2ef9822df3bd0eec609a948.png,"A jungle's vibrant blue parrot, framed by flowers."
97c2b435e7e884d2c8a2562ca549c1c1.png,"A regal, confident woman in a sleek silver gown, warm light casting a golden hue on her elegant portrait."
b32f979fb39f11af0dc36b97a8a205a8.png,"An overhead view of seven radiant red dice, varied sizes, on a wooden table, glowing, dramatic, and mysterious."
e91f3186cb0106318631ad0312fa3332.png,"An enchanting illustration: ""Woman in Black with Red Accents, Surrounded by Butterflies, Moon, and Temple."""
54087fce8cf95656894651a187320136.png,"A close-up portrait: a confident woman with a fierce gaze, dressed in black leather, set against barred windows."
c9d2121a2fbf7902522888a6d20d819a.png,A confident woman in a corset and braids poses in an industrial space.
b36b5b0644800ca6530f66288847c8a0.png,An illustrated fox connects with viewers amid a grassy meadow.
ca097c1011f11a71de8290d2753983ba.png,"An ethereal, fantasy sketch: Blue shell beast lit from within, on a wooden stage."
759373969f0dd00b91e9383efc412d6b.png,"A vibrant digital artwork: Woman metamorphosis amidst fiery hues, joy, and ash."
0587dd7cd9df5fad8c2165ea0d4fcefb.png,"An ethereal, close-up bouquet of monochrome flowers with a single orange accent, centered and reaching towards the viewer, set against a calm, beige backdrop."
832acaf5aca7b23f5dfd84b84051ebd1.png,"A regal digital portrait: A woman, adorned in a sunburst headdress, captivates with unveiled eyes, inviting interpretation."
210eb9c36d365cd2ae308954e0e35791.png,"A vibrant, digital portrait with a face adorned in intricate, swirling patterns."
b03bfb3f505085c71bfa13f14a202853.png,"An ethereal black and white landscape: majestic mountains, a winding river, and ethereal birds, framed by nature."
13ca6d6f404f2174d9db50bc98d9f41a.png,"An ethereal triptych, three confident women strike poses against a black backdrop: a vibrant purple, fiery orange, and rich brown."
8be641f18dd82424dbb0911e6c41285a.png,"A majestic, nature-inspired portrait: A queen seated on a leafy throne in a forest."
c43c149be4d562ff15cdaf4da2348759.png,"An adorable plush fox, dressed in a steampunk-inspired hat, sits frontally with a captivating gaze, inviting the viewer into its whimsical world."
75287afb0ba0c5059f625b3da53a77e5.png,"An ethereal, ethereal atmosphere envelops a vintage car, a 1930s dream in lush green, at the heart of a monochromatic stage."
3e459fe845537a484e880daca0f1ca68.png,"A serene fairy with intricate natural details, floating in a gray expanse."
2719684a3e1d75c0bccea5535f734c15.png,"An eerie, balanced surrealism: Gray face, construction vehicles, and a building grows out of it."
305e6d6cfbfab3107c1d21607546a8c0.png,"An ethereal, detailed painting of a mermaid's realm."
a40beb7e8e18876aa707726953407a62.png,"A galaxy's heart, a cosmic tapestry.
Purple-blue, stars glitter, swirling clouds awe.


Feel free to provide further image descriptions for me to convert into AI art prompts!"
9e18a903ca19bd0d066a829bef420fca.png,"A moody monochrome skeleton with an ethereal, detailed style."
358c5e56e26ba67326495ed73874b064.png,"A serene Chinese maiden, adorned in vibrant silks, poses amidst an elegant canvas of beige and gray, her gaze exuding quiet confidence."
68aa274ed1bf615366069c7e6b643797.png,"A symmetrical mandala with a central clock face, blue and gold details, and celestial symbols on a dark background."
cdc4acf1c83bc603a36eef127a2c387a.png,"A warm, cozy bar, blonde woman in a gray top smiles at the camera."
9c5edb7385446ecc61876e785a4d4639.png,"An ethereal, vibrant burst of colorful motion with a hummingbird in flight amidst a swirl of orange and yellow, poised above a purple flower."
f1fecd27a37add2de0755480b6976ba4.png,"A futuristic robot, elegant and mechanical, with intricate details, stands poised in a world of dark gray."
5bbd1e6c54e11f935e52649aaa13ecb1.png,"A forest's magical portal: Intricate, ethereal, inviting."
dec57a74b1be0c68f7d42e3c0c42ee48.png,"A futuristic city's awe-inspiring skyline with a multi-tiered bridge, vibrant orange moon, and two observers."
604a75632951472dc9bd465f874c12a2.png,"A digital artwork: Futuristic cityscape with a spherical structure, dual moons, and a solitary witness."
5d9564b7e1abbdb33f4ca72cc14c7be5.png,"An awe-inspiring, low-angle view of the Northern Lights, with a starry sky, reflected in a tranquil lake, surrounded by majestic snow-capped mountains."
287df6b6d9edefdd81ef932f0f0ce738.png,"An ominous wooden hourglass, with dollar bills and wooden coins, against a dark background."
61c0b2071b305cfc8e0e8319efb77e45.png,"An ethereal, swirling cat, full of vibrant pastels, stands out on a neutral beige backdrop."
6fcc8be4e6f8a590a9122817a00b94ac.png,"A muralist's engaging moment: Galaxy on wall, vibrant blues & oranges."
f12cbde7e2c08ff82e898f36e8426d05.png,"A intricate starburst with layered geometric patterns in dark blue and gold, centered and encircled."
5dbd0eb2d6b91f85c6ef96672b71d568.png,"An ethereal, dreamy van Gogh-esque scene: a woman in a blue dress, surrounded by a cluttered room."
8f81049debc4d09508d1a6901747a9fc.png,"A vibrant, harmonious foreground portrait: Confident woman in yellow, beaming, with headphones."
7c20ac084d51e581a2230235b28ec9e0.png,"An ethereal, fantasy-style close-up of two mysterious, ornate rings against a black canvas."
3e7ae24c30401d8583709bd4292c0e7f.png,"A majestic portrait: Blue-horned warrior queen in vibrant attire, striking against a dark background."
f501f719c6a7c064af03ac49b7b6f49b.png,"A digital backdrop of an orange-hued sky reflects awe and wonder as a solitary figure, dwarfed by a towering robot, stands in contemplation."
7e42c6d18ea82ef3e4409696b8e52356.png,"An epic, futuristic space exploration scene: a vast station, a tiny astronaut, and deep space."
80e75f8a5f3ef5388709dc6f086914b1.png,"An imposing futuristic city's grand clock tower, inviting an onlooker into a vibrant, technologically advanced metropolis."
b51f7e632064def082ec866ab1594743.png,"A detailed, contrastive scene: vibrant bee about to fly off a bright honeycomb against a dark background."
5c14c52096632bb75db6e08ba6f6edc6.png,"An intricate future city, with a spherical central structure, connected by cables, and an orange and pink sky with three moons."
1dee06ad6895872c1269c6ee7adf7ee2.png,"An expansive futuristic city, dominated by an imposing gray structure, under an orange sun's glow."
0fa0c47254599ec4c064b1ee4e634e4d.png,"A majestic creature crowned with flowers, armored in blue and purple, its eyes glowing in the dark."
7f967992f193a3e06b8c35fa4bf9baa0.png,"A golden elephant dominates a luxurious nursery, a warm and inviting space."
8db61af997d01fb4c86bd1d474374651.png,A white background showcases a metallic cube under attack by golden mechanical beetles.
8d263aa3c2dcf3ed18d1782c80addd20.png,"An expansive sci-fi cityscape with a spherical landmark, blue-hued sky, and human figures."
5acb5025e9846261db6a10387febd1d7.png,A meticulous architectural blueprint in black and white with detailed measurements and material specifications.
f1a751405a3859dcb2adfe9ec727933f.png,"A close-up oil painting of a mysterious woman with striking green eyes, framed by white hair and dark purple lips, emerging from a dark background."
6741f4ca3f0e82c2b02316c52de3709a.png,"A breathtaking digital art depicting two curious baby dragons adorned with floral motifs, seated on a gray rock, against a dark background."
6fe4fc348b495d3ede6ae52b7d8cd427.png,"A bold portrait: Man with gold-adorned face, confident gaze, dreadlocks, and beaded necklace centered on a dark background."
2613e0585ca5f08baf32317905282025.png,"A moody, elegant illustration: a woman's face half-covered by a gold mask."
21527f581d1e13fd3bd286b2bfb000ae.png,"A black and white crowned queen, adorned, gazing intensely, with detailed gold accents, set against a dark architectural backdrop."
374349af350faa2c8e61eafc4249a7b9.png,"""An intricate blue eye within symmetrical gold shapes"""
66a8b930fd4ff9e58602375f3acd1101.png,"A digital illustration of an elegant woman with vibrant turquoise hair, adorned in a lush, verdant sanctuary."
0e3e7062425869acdeaf0a967aec669b.png,An ornate pocket watch still life with a gem-studded case and intricate gold chain.
06b89030be9ed4c33c3a17e9657b6472.png,A futuristic black background showcases a symmetrical orb and intricate golden gears.
894e1bc9274d9ab33e42c6fb0e913afb.png,"An atmospheric gray cityscape with an orange robot adorned with blue lights, sharp claws, and a blend of modern and traditional architecture. The scene captures a harmonious interplay of technology and nature, with flying birds adding movement."
be585df958a32ff8f2bc36c1fbd5f024.png,"A moody black and red bar scene, a man lost in thought, silhouetted."
62a25f298dcbcfbc6687b2dfaa554734.png,"An ethereal painting of a red panda, well-dressed and spectacled, amidst a snowy blur."
f3ff8c195914f12646e0e8f677fb7ff5.png,"An illustrative scene: a resilient warrior woman, prepared for adventure, stands out against a desaturated cityscape."
375aa1797f0bbf19a0b719539458ee79.png,"An intricate black and white leaf pattern, detailed, curved leaves on a grid against a black backdrop."
12f749f2d0429a6616a305f2cd00c46d.png,"A bold anime warrior, central figure of determination, with vibrant blonde hair and red & silver armor, stands out against a blurred warm-hued background."
f77d7ba1c9dae8dd86832303a0b47b17.png,"A close-up oil painting of a fluffy cat nestled in a basket of yarn, surrounded by darkness."
e64facc89692b0809236c7675d23e814.png,"An anime illustration with two characters, a tale told through vibrant colors and mirroring gazes."
fcce184db54e06aeecc3d1daedb1c35c.png,"A majestic portrait: Man with dreadlocks, adorned, side profile, powerful. Lion alongside, gazing, wild and free. Smoky background, vibrant subjects."
8f9bb44227d5154814adf8f129c76c60.png,"A charming kitten nestled in a rustic basket surrounded by a playfulness of yarn, against a dramatic dark background."
d9cbf418e1017c87c1d40f45c203ab8e.png,"An evocative oil painting of a vintage car rally on a mountain pass, capturing the sense of adventure."
ddbce379e8c020777454839b23460ae4.png,"An elegant, luxurious logo design with a dark, ornate backdrop, prominent ""O"" and contrasting orange and gold accents."
1b90db7ea9bb4e5b625ae2b1d1e56882.png,"An ethereal, glowing stained glass bathtub, a harmonious fusion of vibrant colors, transforming the mundane into a work of art."
854553c5021086a928bc9510194bfe02.png,"A majestic woman in a white and gold ensemble, poised before a grand palace, exudes regal authority."
27a7086381c1e4aaabaa6fa693c49a8a.png,"A futuristic woman beside a lunar-green spacecraft gazes upon a city of tall towers and deep blue skies, ready to embark."
9b5aa262e2725b4f5225cc7c40ddac16.png,"A bold digital art piece: Blue & Orange Warrior with Mohawk, Intimidating, Supernatural"
ee41784141b5529892f16627dc18c2a8.png,"An ethereal, powerful portrait: A Native American leader, adorned, against a stormy sky."
9c1990d36920d06ec2be058d751ed3a2.png,"""A playful illustration of Einstein in a colorful cosmos"""
e0f3c04c67c783197a048cbf28645178.png,"An ethereal, surrealist's feast: A grand cake with a facial motif dominates a dreamy scene."
98b69f03fa9430f8a63549d680029e5c.png,"A futuristic city's awe-inspiring Zeppelinesque spaceship, towering over a vibrant metropolis."
fcd94fa3897a9b16afb141dd437aff00.png,"An ethereal, serene glass sphere's reflection, poised on refined rocks."
c33a222e494b0f0e949d8e3cb53a976b.png,"A close-up, surreal fusion of a woman's face and fiery landscape."
05a40f7ad8a5e94fb1b976367a404b51.png,"A colorful kitten plays with yarn, surrounded by a monochrome backdrop and accessories."
36769d6571883707c2db4fca3206da21.png,A black and grey charcoal drawing of a playful cat surrounded by yarn.
c7a056d5ef9c7003b1991fccab6deb73.png,"A blue digital illustration of a majestic wolf, its white fur contrasting with a dark, starry blue background, conveying power and mystery."
b6aca4f8e99a299c5160dc277f137375.png,"A futuristic metropolis's decaying landmark, neon-lit and overgrown."
6e9c1f457e9a56761dd5472081895ff7.png,A neon-hued robot insect welding in a futuristic workshop.
0c34f9f5f4fbd46aa87044b534e96965.png,"An elegant digital portrait: Confident woman in orange with dramatic hat, floral accent, and golden jewelry on dark skin."
63a375022dee27972b02775fd0bcbeaf.png,"An ethereal, avian symphony surrounds a black vinyl record, amidst a gray mountain range."
bd90171cc0fc437340522ff58a763f7d.png,"A confident child, golden and playful, stands out against a black backdrop."
ee4244c777763c4b2259ec0898efcc7c.png,"A black and white portrait of a suited man, focused, standing before a complex, futuristic machine."
9c04102043c8f4af49936dc1bf1f124c.png,"An orange-hued, whimsical scene: a girl with turquoise hair, a white rabbit, and a table of curious objects, set against a lush, warm-toned background."
59e4dade1b7657658845d56af19a99cc.png,A vibrant watercolor illustration of a tiger cub's lively gaze on a dynamic white background.
47d4f6d478d4ddf101c297b2a430a0d1.png,"An abstract, digital cubist composition featuring a central red face surrounded by a vibrant, dynamic orbit of smaller faces in a harmonious chaos."
e3108568ae305ebd18f7892de7e39acf.png,"A digital drawing of a passionate kiss between two suited men, close-up, against a gray wall."
0fcbce31676d1069c27e2982e75abc36.png,"A vivid scene: astronaut atop a yellow excavator, digging in a dark room."
1acf56d8b8e59423463c37298cabd6de.png,"An awe-inspiring, serene sci-fi cityscape at sunset."
635047d088c65ceb197698f5006a2e72.png,"A serene digital portrait: Woman on a cliff, orange hair, gray dress, moonlit sky."
42e792c2c8e49180cc0a97ed28144591.png,"A Gothic-inspired portrait: a young girl with expressive eyes, silver hair, and intricate jewelry against a deep red backdrop."
d2f48e4ec2d619c790aaaec5ca1f828b.png,"An abstract, close-up view of a warm orange motherboard with a complex, symmetrical network of circuits and chips."
9bf937ae68674e5dc0ba00c2d4611c44.png,"A bold digital art piece: Blue-hued demonic figure with vivid red details, intense orange eyes, against a mysterious purple-black backdrop."
1095658638ce86b1a42744eae6aed618.png,"An ethereal, neon-lit portrait of a futuristic man with wild hair, clad in a hoodie with blinking server walls behind him."
ec625431694cd2f56422587dde5e7fe7.png,"A bold, elegant woman in a red dress with a whimsical dotty coat."
abf5fb4d9c7a70af99428062c2dd9a83.png,"A futuristic fashion statement: Woman in a high-tech helm, sleek blue jacket, and a dark industrial backdrop."
39af1934d9682bee078746fe507a691b.png,"An art nouveau-style illustration of a cat's head with intricate gold and black details, stunning yellow eyes, and a solid black background."
8e1bbf29d10fbb8e6c11f8056271390b.png,"An epic, dystopian warrior, armored, mysterious, and imposing."
4f45ed6d43e87b4a8e54184192188f0c.png,"An ethereal, colorful portrait with a mysterious woman adorned in a vibrant hat, necklace, and earrings, standing out against a subdued gray backdrop."
9dae3396ebd9fddc2fd3abc18d080c20.png,"An opulent, airy room with a colorful, tiled spherical bed."
a1e745bfb68e35b76481b88cb366cc37.png,"An eerie, abandoned room with a forlorn doll clad in blue and white, perched on the cluttered floor."
312f7dc3c2c615c9a03793a38df1db45.png,"A close-up oil painting of a vibrant blue eye, with long lashes, yellow makeup, and shimmering droplets of water."
a2bba8a946d5ccd4601ac7af9b767d95.png,"A medieval hall's grand celebration, horned figures, and a feast."
a449337882832a28ce168f7b8a3c4fba.png,"A vibrant still life: Pitcher pours vibrant blue liquid, lemons, wooden table, black background."
a0ea9b43170d099adb18746b1f2a8358.png,"An ethereal, elderly woman in a blue jacket, centered amidst a floral backdrop, serious and deep in thought."
702685db1b209227317d8bf9cf119a45.png,"A neon-lit futuristic figure, elegant and dynamic, kneels in the dark."
96c6f297db05c6de623035a3a2a94e1a.png,"""An ethereal, floral serenity: Woman's visage adorned."""
52a9431b4b1821c74f252a54bdaec377.png,A realistic gray fighter jet's powerful flight over a desert landscape.
c6f74a5abe38dfc45e9a6e61c2a03801.png,"A warm, vibrant bar photo, centered on a blonde woman smiling."
ab39fcb53e5906216bddcd959cfe41a8.png,"An ethereal, surrealist oil painting: ""The Flaming Dress"" captures a transformative moment."
18767b0e411dcef5e7a43b7e762eba64.png,"A ethereal, captivating portrait: a young girl in a lace white dress, with curious blue eyes, against a soft gray backdrop."
02a53ec7a08fe3cf9eca616a181f4f62.png,"A vibrant blue digital illustration of a fierce tiger, its eyes aglow with power."
e81c19e23e6de62078c34eb1db4c3dcb.png,"A realistic digital artwork of a bearded man with an introspective gaze, centered on a neutral gray background."
fb63259f6ec667647a082a4776a7c2cd.png,"A joyful girl in a green kimono at a bamboo forest's heart, surrounded by warm yellow and cool green, exuding serenity."
a56c23c80c0a22ba2fb5e3b484493408.png,"An intricate green train on a black backdrop, ready to depart."
8a0b5fe0212ac5c736d426321acd62cd.png,"A gloomy, controlled demolition: Man oversees the fall of a large white structure with a shocked face."
15556ef94cddbe9382164f792c340f43.png,"An impressionist's colorful pencil drawing of a vibrant, ordered nature scene."
6d55c4bdc8e78a765b1484dd945504f4.png,"An ethereal, patterned waterfall amidst a serene, colorful landscape."
05aeb23401552b165a55d1fdb7639cdc.png,"An ethereal, elegant enigma: blonde woman in green, gazes upward, encircled by stained glass hues."
0277d3b0ee551c5c055670a2d1c64d9e.png,"An ethereal, fantasy stained glass window depicting a moonlit tower."
1c30f0a9955f90b489f9348896b2570f.png,An intricate diorama inside a stylish glass sphere.
135663b7278fb8ca1619187f263f8e54.png,"An intricate paper art scene: lunar mountain landscape with rivers, clouds, and flying birds."
234413153e5d8774623d945b6ec7fd8f.png,"A mesmerizing digital portal, gold & black motifs, blue backdrop. Swirling vortex at center, enchanting golden particles. Fantasy & Sci-Fi fusion."
f88dc84ed31222525cfab4624a57df81.png,"A serene portrait: Futuristic woman with glowing skin, mysterious symbol, calm gaze."
92dcfacd316d7a8e656c0f007abaa129.png,An emblem of nature and cosmos.
1a69073d191ec49143f714768d4bc7ca.png,A vibrant orange poppy flower enclosed in an ornate golden frame against a black backdrop.
fb5288dfd76fb016a692d4701cb783a1.png,"A futuristic queen, illuminated by a blue orb in a dark archway."
d5db20d39f159100e6ea3d23113a1adc.png,"A vibrant, intricate clock face centerpiece with a black background."
49a580c97b163a335db77a8408f1393e.png,"A golden leaf base beneath an ethereal, swirling galaxy sphere."
89ea9e29864eab5f537e5ccb64ab30c1.png,"A detailed fantasy snow globe, with animated city and stars."
8a5aeaf20da2d2bc6d3ffb31168e828d.png,"A futuristic warrior robot, armored and glowed, stands out against a stark white background."
b2cfc4243142d7da7ddf323c6e22236e.png,"""Epic Panoramic Mountain View, Dawn or Dusk"""
c25e106d5ef99e0e9ae9e3011dabda60.png,"A detailed and enchanting diorama, framed within a circle."
1bc3aa286cd6fc328e2ea41e56fd5807.png,A futuristic portrait: A confident woman with blue wings and horns against warm red hues.
247179c2dd7c323ee7d218e9b829cf16.png,A heartwarming digital illustration of a girl and her bear companion in a colorful forest.
6d464bee65402d244e063641b63ef38f.png,A serene East Asian woman's portrait: Nature meets traditional attire.
85c6758c93633b0a6623b2dac95f8062.png,"An ethereal warrior, armored in vibrant orange and yellow, stands out against a cool blue backdrop."
21275c13a5ef25b08cba48427375cfd3.png,"An ethereal, serene Chinese woman in a vibrant, patterned robe, centered and surrounded by darkness."
af94ddcd6a6576aba00496c369453764.png,An oriental garden's peaceful haven with Hello Kitty statue.
af00e0bb4c66a040ec42cf5f75f6d942.png,"An imaginative, whimsical still life: a city inside a bitten apple with trees."
56c94b44dd7c522fa640348421b5777b.png,A detailed and mysterious temple illustration with alert white mice.
2f882cfbcc98f8dd075e2bc7732cde2a.png,"An ethereal angel, dressed in white, holds a golden clock and a bird, centered in the forefront. The deep blue background adds mystery and depth."
d329880d09e730ff85f4c9209b2a122f.png,"A contemplative enigmatic elf with long white hair, dressed in black, smoke rising."
954268785a6af884d301af142bc8c7f1.png,"A vibrant, surreal creature with a dominant eye, in motion against a dark background."
99242f43aa17b48d1bd07be8584b616d.png,"An ethereal angel, glowing with divine light, stands on rocky ground, symmetrical, with intricate golden wings, in a dark, spiritual encounter."
1e5dec0652ad570c5e9c121dbc612842.png,"A black and white illustration of a woman with curly hair, gazing directly at the viewer, set within a white circular background."
fa9d0df72d9573546a37daf06dd9851a.png,"An ethereal owl, wings spread, perched on a golden flora globe, gazing wisdom."
1b05fc053cc7dc92ef0d73077a78fa17.png,"An ethereal, romantic portrait: A red-haired woman, adorned in red and white, amidst a blur of warm hues, holding two red roses."
157df1d7e9ebaefd762327dc2fcb6972.png,"An ethereal portal's illusion, intriguing a spectator."
7d6b6270aac3c9cbc0b9e455bfc4665c.png,"An ethereal, orange-hued queen, adorned in black, holds court with her book of secrets."
cd901d444c8f3fe301c43d4204828429.png,"An intricate heart-shaped collage of diverse plants and flowers, balanced and harmonious."
d075d059511ac2f582bc0b90285d2f5e.png,"An ethereal, 3D nebula of purple and orange hues, deep space backdrop."
