image,short_prompt
341e438805d0339dca9a4084a90fd6dd.png,"An enigmatic woman stands tall in a futuristic hallway, exuding confidence. Her distinctive white jacket with puffy sleeves and high collar contrasts a beige skirt. The yellow-walled corridor, with its lofty ceiling, adds to the grandeur. Her determined gaze meets the camera. A fusion of fashion and future."
1a5e3ab8544911fcccd2691b90938889.png,"An epic journey's daring figure standing before a vibrant, swirling portal, ready to embark."
b72f3359bea58e067dce5132cc2ec98f.png,An epic oil painting: Wise Man taming a powerful blue dragon.
65f2021764b0b46101c3c713f571c3b3.png,"An elegant, wood-panelled library with a grand spiral staircase."
855fc96b9d26d8923b3205dd8bacaece.png,"A retro diner, five friends in red and white uniforms pose at a striped counter."
204d49864c15957b4cc1b3c38f45b692.png,"A surreal digital illustration: a skull-mouse on a book, surrounded by floating objects, blue and green hues."
d04bf4c2f82a9c89026c4c37aa9c0aa4.png,"An orange tree reaches heavenward from a circular hole, under a deep blue sky, digital art."
43553738027478c53007a7136fd8dfc3.png,"A gray shoe with an intricate silver filigree pattern and a stationary birdcage heel, set against a dark background."
1634ca7d69d22987283a5b737a6c7967.png,"An orange and blue painting of a woman riding a dolphin in mid-leap, surrounded by harmony."
a28830b8bf737788a93225a93bbf65f2.png,"An ethereal, abandoned library, majestic with natural light, towering ceilings, and ornate columns. Bookshelves line the walls, once filled with knowledge, now silent, with only scattered remnants remaining."
0bdd124c369517098f1e31c6a4b77d36.png,"An octopuses' graceful dance, blue underwater ballet."
bad7100048692c0928b21a0f4e20d47a.png,An isometric illustration of a bustling pirate island.
e37b8339501df882e55428baa8920308.png,"A majestic skeletal warrior, prepared for battle, shines in golden armor."
af96a038525f1ed00a4cff02c621d15e.png,"A realistic, close-up octopus portrait, blue-eyed, with dynamic tentacles, on a dark background."
44a26d42bc01b36027429c0f246c9144.png,An epic oil painting: Man in red robe commands a dragon.
c4b737bc04a12293dec9d5a993f1c568.png,"A close-up oil painting of a serene woman with striking green eyes, framed by a black hood amidst an urban blur."
940f95de451ab5a41a1eb4d525026259.png,"A realistic image of a robot ant, detailed and colorful."
5d9c1d879251083fe871db30de256ab9.png,"A close-up oil painting of a vibrant, wet, reflective leaf, with a colorful, blurred natural backdrop."
47146fb34b986f45c8a02d32aee18ca6.png,"An illustrative static scene: white synthesizer, orange accents, clean studio space."
5a328c3f2ef374777bdbcf5017a521d6.png,"A studio portrait: Woman in white shirt, warm light, striking gaze, formal yet engaging."
de09b03b9e31572f823a0ea76a7ee13a.png,"An anime art of Itachi Uchiha. His intense red eyes, black hair, and elegant attire pop against a dark flame-filled background."
8ea9ec693ba3f4b2e508fe4cc0029160.png,"An enigmatic portrait: Futuristic red & black headdress, vibrant orange eyes, centered, against dark red."
be0253be0d1eb9e37273aa23dbcc2381.png,"A close-up illustration: a curious child, blue beanie, and striped scarf, wide-eyed, against a gray canvas."
bc23c21f72d0479c5dd1d88240cb7faf.png,An ethereal twilight forest with giant blue and orange mushrooms and fluttering butterflies.
429f90b7195365f97549bdb124bd22fd.png,"A futuristic warrior, a muscular anthro with a dog's head, confident and armed, in a smoky realm."
d76e5e3c691e76ae91ed830bd66e61af.png,"A vibrant impressionist painting of two joyful African women in traditional dress, celebrating friendship and heritage."
245ed0a3723fef9fbf1435fe60729ea6.png,"A bold, central figure in black and gold armor, with fierce eyes, set against a dark background."
ca0a52b3df3424d2f09d2c48327c771b.png,"A realistic portrait of a serious woman with silver hair, winged and adorned in red, set against a dark background."
9a61085728cfe68c976f2c3fedab8b36.png,"A Wolfs' digital piece: Blonde woman in raincoat, serious under streetlight blur."
f2c1da2afb0aef57e8ddbd3ee56b7c9c.png,"An ethereal, inviting glass sanctuary beneath the Northern Lights."
2a8d2d9b067ea35bd9a0471445a5f7ab.png,"An illustration of a determined red-haired warrior amidst a lush forest, his vibrant hair contrasting the natural tones."
bd54150ce8cafc31a6af797d719ef3e7.png,"An up-close view of a intricate honey-themed candle, awaiting ignition."
c7f9c16d6c7223a55b3610c4feaa20d2.png,"An ethereal, starry night landscape with a celestial path leading to a majestic tree."
7b2e011d0d5c992061ba275596beec18.png,"An ethereal, mysterious woman with a crown of thorns and leaves."
921d7a9c25f3fb87d5f008330210fdd1.png,"A serious woman stands focused, clad in blue, against a floral-patterned wall."
ece9b8ddfe1d2810234c68a1477f2a3e.png,"A vibrant, chaotic cosmic explosion frozen in a fine art painting."
21877a7608cbdc6490c968f6771cedac.png,"A stark black and white portrait: serious young woman, sharp focus amidst bustling blurry background."
eb2a7773618e75ac9adb8b75a410771f.png,"An ethereal oil painting: Vibrant planet at center, cosmic symphony."
b0852fa15e4756a10c47f1772c5e5aae.png,"An illustrated whimsical scene with a red-tailed squirrel chef, surrounded by a nutty paradise."
dbd06df10a517a2a906b6fdc6767d738.png,"An ethereal, majestic deity with a golden halo, adorned in solar symbolism."
3a340ea68f7d86ce64a29adb7ad7430e.png,"A vibrant cityscape portrait of actor Peter Falk, capturing his contemplative gaze and sophisticated style."
b3ddcee1c159de206d9d6f037557d39c.png,An ethereal oil painting of a young girl and her enigmatic doll.
9c19bb4bb9af9726597142d0c156abfd.png,"A detailed and vibrant World of Warcraft Night Elf figurine, featuring a slender, regal character with vibrant blue and black attire, purple eyes, and a mysterious demeanor, holding a staff. The gray background highlights the figure's intricate details."
f20f0ba91fe47a48ac1a6fb381ad3d0a.png,"A monochrome portrait, a confident woman in leather stands out against an obscured painting, creating depth and narrative."
0b151a14c3ad691654b792d710f89b11.png,"A warm, inviting digital illustration of a girl and her cat in a park."
3001b4fe8caeca8b524190aa53da38cc.png,"A black and white snapshot of a car assembly, frozen in time. 





"
6725ad80a64b0fe75148ab681b223d49.png,"A regal, enigmatic woman in an intricate headdress, centered in a dramatic dark red backdrop."
0e71701bea0284dd8793b06f6ccf03b5.png,"A futuristic, shadowy laboratory, with suspended glass containers of glowing green liquids, connected by a maze of pipes."
8fefa2fc533c1ab7a371621594ebe45f.png,"A warm-hued, starry night sky painting featuring a young girl in a blue star dress, standing with her black cat."
7e7d4d98e862077cb8066614ced7a5b3.png,A realistic digital art of a joyful girl in a snowy landscape.
20895a48515b86250c1c7eefdb467a85.png,"An expansive, serene landscape with a winding road leading to a lone house at the foot of a majestic mountain."
2bcb7ca7b6cfb819592974ed3551e3f1.png,"An oil painting of a majestic queen, surrounded by black birds, adorned in green and gold, framed by nature."
303f75ef6fd347153c16cac696be717d.png,A serene portrait of a woman in a white dress with a nature-inspired headpiece.
89653413b1707f79a63190af36f78730.png,A black and white Yin-Yang cat duo against a solid black backdrop.
490f8311fe77d696fb44defb23fe3b83.png,"An ethereal, close-up pastel painting of a red dahlia, slightly blowing in the wind."
59ec1c15574d72e5ee83f18748fa7ed8.png,"An abstract mountain landscape, vibrant and energetic, with bold colors and dynamic dripped styling."
5ae73f7b7ab914cfb491e31209bac100.png,"A whimsical green haze, actress Sarah Paulson soars with a spotted cow, their hair flowing in the wind."
76c85323f2322f409b8c2b482765508e.png,"A vibrant, detailed digital art scene: Girl in red & blue tends a campfire in a serene forest."
eb9d6c886afe3d80c19ff1d0b69b62f9.png,"An epic, futuristic vista: a circular portal with intricate patterns leads to a harmonious world of blue, with dual moons and majestic mountains."
d97340ada006f902bfbbc5ac75426adb.png,"A whimsical illustration: a squirrel chef with a mushroom hat, cooking using magic."
b886f6a5c8afb927fb4c09be60874cf3.png,"A ethereal nocturnal scene: 2 figures in white, one with beard, gazing at each other / towards viewer under starry sky."
2751fa3b55a55ea8c415e6d548e52f0f.png,"An ethereal, futuristic architecture fusion amidst a lush landscape."
2aa74a5c20841f47bf4a848a794bd87a.png,"An active, story-filled forest scene: a squirrel on a boiling pot, its blue tail a pop of color."
0a7c16378c8d3da08be2b6276a839583.png,"A serene forest sketch: A green creature cooks, focused & peaceful."
0e74805d57c6ed61d0a15d54bb58876f.png,"A digital artwork: Elegant woman in green, adorned, mysterious."
462f561c2a3ea1e68627392f0f86ca62.png,"An ethereal, detailed gateway to another world."
8a4e72f4484c877269e6a312499dd1d1.png,"A whimsical fox-like creature, adorned with leaves, sits on a rock amidst a mystical backdrop."
cf97083e8049fbfd0124a34aa474cd8d.png,An intricate black and white mandala with a celestial theme.
9f56df8c1d9daf0d6767a61e43b50a2b.png,"An ethereal digital art portrait, a woman's vibrant head explosion captures the human mind's essence."
05afd1165a078aa4b94851e5068ccf77.png,A whimsical digital art piece: Girl and Octopus in an Ocean of Jellyfish.
f82a2b29073946e2c94aff104931e7ae.png,"An ethereal, surreal scene: a girl and floating octopus, vibrant digital art."
b36433913cf1ae832357d64672520aa8.png,"A captivating digital illustration: a bold, spotted black panther surrounded by vibrant flora, amidst a deep black background."
28c45c9aad4a46a5d3cb3930e8dd16fc.png,"An elegant portrait: Two serious individuals against a dark canvas, formal, gold accents."
ba3b90eefefc9aeb0d357aac8e9376fb.png,"A detailed blueprint of a majestic temple, multi-view architectural drawing."
59faa95f2fb08bc15c4a8a9a6473b6f7.png,An illustration of three masked superheroines in vibrant costumes against a white background.
175d5192ef548c721bb5d16239b95ed5.png,"An intricate, elegant golden ""B"" with a dark background, vibrant interior."
98c6017061e00e4048822a80c5d1c22a.png,"A majestic tree illuminated by moonlight, its roots intertwined with rock, amidst a starry sky."
90700207c7ca097fd1d0256ed10815e3.png,"An ethereal, lunar-lit garden teeming with vibrant flora and insects, serene and harmonious."
ebb4d6f2ca8b259050ce4c442de4e856.png,"An opulent blue and red headdress, vibrant makeup, bold earrings, and direct gaze."
718ce1accef13a644d5b8b38088dd285.png,"An ethereal, cosmic dance: Sun and Moon in circular unity, spiral-bound, against a dark canvas."
a3c58d586b6211bdabe96c3b27155d0d.png,"A vibrant, detailed digital portrait, focusing on a woman's face, adorned with a feather headdress of intricate patterns and bold colors, creating an enigmatic presence."
525bbbb968878b941463992fac37253e.png,"A red rose garden; a vintage-styled woman, centered, her bold makeup matching the roses, a gold necklace her only accessory."
03fbeb263fec023968a675e27cf65846.png,"An awe-inspired witness dwarfed by a towering triangular iceberg, a solitary figure on blue-hued ice."
9458d65ab22a8287aa112b3be9c3866d.png,"An enchanting toy figure scene: two figures, a girl and rabbit, in matching pink and white outfits, pose against a pink wall and green floor."
59ad6db54bef559496b0ec57747fe2ec.png,A detailed silver wreath on a dark blue background.
d250d7439d1ae120d06e0d14e695b110.png,"A majestic woman and tiger, adorned in green, sit centrally amidst a luxurious background."
3e8283f8956409bde218ab831ed0c61e.png,A pastel painting of a sheep among daisies in a mountain meadow.
d1332a92c1a91bac6362f6c2d1aa59ba.png,"An ethereal, futuristic warrior rests in an orange and purple desert."
c25b25dee25517f84a1b6a697466c7b5.png,"An eerie, tentacled figure standing on a textured beach gazing into a lush blue ocean under a grey sky."
c27340db018889c2e7002410a8edcb8a.png,"A vibrant digital fantasy forest with a colorful, surreal twist."
865c3c2f5c3bbdb83a58fe830cd7189b.png,"An ethereal, colorful controller floating against a black, leafy background."
65e99fc772d99e9ae06ca340624364ff.png,"A bright, serene woman stands tall before an ancient Greek temple, basking in warm light."
fb81bbe470dab5fcc028258c3d145ac8.png,"""An intricate steampunk-tribal art piece, focusing on a detailed headdress."""
231c43de7d126e9f21a668998ddfc4e7.png,"A black and white ink drawing of an intricate, interconnected cityscape with a central landmark."
9b05d10e4b7f8370a85def56bdc8343f.png,"An illustration of a fearsome Dragon Knight, ready for battle."
64eb2f8d9191189d958e5347420bf7fb.png,"An eerie, futuristic cityscape: Boots, gleaming circuitry, and distant figures in a world of ruins."
778fef5ea84acd790254b89e9cb7e55b.png,An orange and white sailboat turns dynamically against a black backdrop.
26e4f97f0399ff076f69097ea2efc615.png,A melting metallic skull in vibrant blues and purples against a dark gray background.
2c2a506eb9fd6756bdc9b53aefdfbf49.png,"A futuristic green cityscape, two robots embrace in harmony."
a3ddf571f9334f60db819eca84309fb5.png,"An ethereal, colorful portrait, featuring a veiled woman before a symmetrical, radiant stained glass window."
9beba4805bf956c6cf7c6c37cfc80ce3.png,"A majestic feline king, adorned in red and gold, radiates wisdom and authority."
bc0e689e1056778c75fcb324ec8a859d.png,"A digital illustration of a mermaid, ethereal and serene, swimming towards a coral reef."
7b56116c25577557518e061ff9536a55.png,A terrifying sketch of Michael Myers leaning against a bright yellow trailer.
a31e77b352c0055253f2464c672b5787.png,"A colorful, elegant pair of high heels reflected."
1e8bb961739fd7e583031b341238c2c9.png,"A colorful cartoon scene: Girl with red hair, in green dress, holding a flower, sits beside a unique patterned cow, both lost in a quiet moment."
fd8702a280e5234cdca50014a42511f2.png,"An enchanting, detailed tableaus inside a glass bottle, lit by a warm fire."
1ba8d47e102ffce13b9c7a4023c0d202.png,"A vibrant, patterned face, crowned by swirling spheres, on a stark black background."
4564ae2327a4a2df4f07827b0275304c.png,"An orange-hued, futuristic city on an alien world, with towering glass and metal structures, rocky dunes, and sparse foliage."
83e7bf3e53f846597ece63b8f1212b6d.png,"""An illustrated portrait of a dapper orange fox, adorned in gold, sitting upright with a captivating gaze."""
e761c6b33644603e1279656dbc645f00.png,A whimsical black and white illustration of a curious cat with a flower.
efac919026d0064a382e983491ead235.png,"An ethereal portrait: A young girl with vibrant blue hair, surrounded by a galaxy of colorful fish."
0bfbc37fc2277f0e4e70d7beff6329b1.png,"A warm, earthy toned interpretation of Mona Lisa with a cascading hair frame, gazing at the viewer amidst a serene landscape."
c7bc49f9353b5d89e9abb99cb55444c9.png,"A digital artwork: Woman's face, green eyes, brown hair, abstract green & blue backdrop, partially obscured by curtain, realistic focal point, swirling colors."
b01277899e3f9e9be6410a67a1d44e3b.png,An illustrated triptych of confident women in a futuristic Disco realm.
a340cfc4d9b5f73439344e6d0163ff6c.png,"A portrait of an adventurous young traveler with vibrant green hair, poised at a train station."
52eb68445ab17fb68be30fc88873d335.png,"A poignant portrait: sad-eyed woman in hooded jacket, blurred train station backdrop."
86d60075695a265158e67c4e88561b26.png,"An intimate embrace, two figures intertwined in a candid moment."
be47b8ea80b3f9b68d1161d8fc46da9f.png,"An ethereal, mysterious portrait: A blonde woman in a purple dress, adorned with a gold brooch and red belt, wears a witch's hat. Her blue eyes, shaded by the hat, reveal wonder. Purple butterflies glow in the warm light of the background."
5a491cd8b31a913186b392da88bddc24.png,"An impressionist's winter vista: warm skies, snow-laden trees, and a cozy home."
42b9a9f49320b4801c7568267fdc333f.png,"A elegant upclose portrait: Woman with floral hair, glasses, black dress."
be20ae629e066ce1145d1a8832975ebe.png,"An epic, Renaissance-style oil painting: A majestic cat, clad in black and gold armor, stands tall, brandishing a sword, surrounded by vibrant flowers."
e2e9f1e105d87a577501e3b626d73854.png,"A captivating steampunk scene: Woman, poised on a complex machine, Victorian attire, and a loyal wolf companion. Dark, dramatic background."
afa5fe1d42a1ca32bf0d2d5ff154dbbf.png,A serene reading moment: Woman in green under a lush tree.
1251a5ef930136a7afd5c777a6051f7c.png,"An adorable toy animal standing amidst nature's embrace, captured in a charming, blurry-edged moment."
0b44cf8ef8e055a5061032b4d1acf8ac.png,"A bold, digital close-up of a woman with intense blue eyes, elegant braid, and soft, luminous skin against a dark backdrop."
131b407dae369eb11f55570b2e01562d.png,A black and white image of a ritualistic dance in a haunting forest.
d21b21e76ec685cd00e4b65d79bb8170.png,"An orange-hued sci-fi city, a cyborg woman commands attention."
60232254438ee774defaebac871258cb.png,"An orange and blue steampunk creature with horned head, its mechanical intricacies illuminated."
0db0d6b811887b50fe3a0ccf58ce96ad.png,"A whimsical dragon, adorable and alert, stands on rocky ground amidst a gray backdrop."
f637793ef2d7e1637ca64fcbbc87da43.png,"An abstract canvas of bleeding colors: blue, purple, gold blends; dynamic, elegant."
7709beb74bfdc5eb7c1b36d76b846d2d.png,A candid shot of a pensive woman in an indoor sanctuary.
c6f20473bf1f679ad06ca3929ca0b61c.png,"An ethereal, futuristic lady in a blue and purple gown, centered."
41161afbbb4485c3b64038e20026493a.png,"An futuristic, eco-friendly home, nestled in a lush garden, invites exploration."
be654733e474450800c3bff5f39f4a72.png,A confident woman in black amidst a bustling cityscape.
72ec7eed2fd35ebad777b611ea0f5f85.png,"An epic illustration: ""The Legend of Zelda"" Link, poised to draw his sword, with vibrant attire and mysterious demeanor."
47edcd5ce2a976b936835f672e88343d.png,"A silver, futuristic female figure with intricate details, meditating against a dark, fiery backdrop."
c04d68a1c7a1a35a942a2888ed4a0557.png,"An energetic, colorful glass sculpture, frozen in time."
402f4570b0b152c9145cd70861a22a37.png,"A vibrant portrait: joyful boy against an orange hue, centered, clutching a microphone, beaming."
715adb778ff0310c781526dc5ebb8f50.png,"A close-up portrait of a serious young woman with wavy hair among vibrant white and yellow flowers, basking in warm sunlight."
5308cb984016fa002770e3db15ab6b85.png,"A stunning white sculpture of a spectral woman with a veiled hairstyle, set against a dark backdrop."
2645caee440a3d6f0948b39f967b8daf.png,"An intricate golden helmet with a plume, centered in a circle of leaves on a neutral background."
423036ad15c8a780f67f363c1d3ef3c7.png,"An inviting jungle oasis with a meandering stream, a warm, lit bar, and an intricate natural design."
2b9a53053f24ce88958408dd7f674210.png,"An ethereal, nostalgic scene: a vintage car parked on a street at dusk."
e2458af7ed0f500aae3b03899647af47.png,"An intricate rainforest canvas: Vibrant tree trunk adorned with birds and flowers, amidst lush green hues."
d0ad619360d5e96d3ebe28527d6e9455.png,"A striking, central woman with flowing black hair, adorned in gray."
6ed6030604d3a07062c7a89bff4f4063.png,"An evening's serene forest escape with a wooden cabin, cooking, and orange skies."
10ebceb94a0d28df776ef46fc864adb4.png,"An epic, engaging close-up of a white-haired wise man in red, with intense blue eyes."
28b45dd577f9c79f9e5aed0ca54c9f70.png,"An eerie, illuminated futuristic tunnel with an orange hue, full of debris, hints life."
2ebf36fd33a7532b1debf0f70d780243.png,"An illustration of a futuristic warrior, featuring a confident, prepared, and stylish female protagonist."
0c5b5d8fd28527ad7181247970534925.png,"A vibrant, colorful illustration of Overwatch's Tracer: a stylish, dynamic figure with a pink mohawk, striking a powerful pose."
939063404f6c183fd0b64f00917b9934.png,"An ethereal monochrome cat, wet with curiosity, against a neutral backdrop."
ab83bb6e1ca704824a1760cb2621c485.png,A ethereal archway of vibrant flora opens to a lunar landscape.
76d6b9849ffc37b0597a4fdf1adc27c7.png,"A futuristic blue and silver suit, a bold 3D character design with a mysterious visor and flowing cape, strikes a dynamic pose, inviting adventure."
dea7ae6a067220ed2d70dc2420c6d9ee.png,"A serene island sanctuary, two trees in conversation, reflected in calm waters."
bc0f1f30cfb85ec15bcf5ac205398a93.png,"A vibrant illustration of a surreal tentacle creature with a kaleidoscopic body, set against a deep purple backdrop."
eec60cbeb14eee26a7ed82eee04f7485.png,"A blurred room's intimate space, Dove Cameron lost in thought, elegant bun, casual attire, book open."
ea8e64801806cbd240df89d1c1bc86b0.png,"A gloomy scene: Mirror reflecting a vintage car, abandoned, seen through fingers."
52fb6f58db0322c716fb90f68f58e838.png,"A ominous forest trail leading to a radiant sky, lone traveler clad in black."
feb7ecdb5d996a0297ce09e7fb2857ee.png,"An orange cartoon cat, seated, with a playful tail loop, against a light blue circle backdrop adorned with white dots. ""CUTRA CHARDLE"" text aligns below, balancing the composition with bold black font. Joyful, whimsical, charming."
63e66e89d2a5ff28c58aad1f4c5c2af0.png,"An indulgent dessert, a golden cake with caramel, ice cream, and whipped cream, is served on a black plate with a sprig of mint."
4a082de3e91544c9651e93e0df78d878.png,"A majestic blue lion with intricate gold patterns, feathers in its mane, piercing green eyes, against a black background."
1d98ac01a3eaa7f1f474a87608fe9db3.png,"An ethereal, colorful portrait: a woman, cloaked in vibrant patterns, against a rhythmic black background."
bcb712c09f3bbedda46de23b744de96e.png,"A red, gold-trimmed egg glows warmly on a black pedestal, intriguing and mysterious."
5cce28d8c1e5477ea3164e4b9bd5e7c2.png,An elegant black and gold architectural blueprint with three distinct views.
df0b31cec01c7b91897b82e3d5c17053.png,"An epic, majestic mountain scene with multiple dragons."
ca39cff11184e07449947345996968c6.png,"A solemn, contemplative portrait: a man with dreadlocks, crowned with thorns, gazing upwards on a dark brown background."
ca5a91bd2a9545da28a85abf7dc95c9b.png,"An illustrated split portrait of playful characters, KooK and Macik, in a vibrant, creative mess."
b44c6cf0cf8b7bc43f6b16e3cd8186f7.png,"An intricate patterned egg, symmetrical and colorful."
6611f8a5d07659d2f91af55d0ab09747.png,"A vibrant, thought-filled portrait amidst a lush, yellow jungle."
14109fcf705f082fd40f4bcd1457c6d6.png,"An epic, powerful maritime adventure, a resilient ship challenges the stormy sea."
a45274617661d6112aa9c2cb13278bb4.png,"An evening's serene snapshot: Woman adorned, nature's splendor, tropical sunset backdrop."
8bc6bae5320fd903f9a2bb5fb636cf8f.png,"A futuristic cyberpunk portrait: Vibrant neon backdrop, patchwork jacket, colorful hair, low-angle view."
314b383743b77b49b1667790ad0eeea3.png,"An ethereal, nature-inspired portrait: a woman adorned with flowers, leaves, and vibrant hair, against a solid green backdrop."
0c6f01a2454ff4f227a2f698f1dddb4a.png,"An oil painting of a colorful cat, curious and playful, amidst a pink and green leaf background."
0507448ceeafe139d83e84f6650fc1a7.png,"An adorable cartoon cow sits on hay, ready to explore, in a charming, inviting scene."
09338c4a8b3ec5b4b2b94428415260e4.png,"A vibrant dragon, its colored body in motion set against a stark white background."
1e155ada9c5c09000b22a965b836254f.png,"A black and white portrait: a woman, candles, mystery."
d6167ad7d0719707a466d9729c3bbaea.png,"An ethereal skull sculpture crafted from ice, forefronting a breathtaking beach sunset."
4b70c33496d9c847e13641c2fe162615.png,A vibrant watercolor scene: a blue bee hovers above an orange flower on fire.
dcd2da3aaa1b761c672abce37cfe6ed5.png,"An ornate bowl, crafted from a kaleidoscope of tiles, shines against a dark backdrop."
c601a46d20493b8fdc71c81305b607df.png,"A harmonious gathering of cats, wooden floor, varied fur patterns, curious expressions, and a reflective backdrop."
e7aaac220d4616651092d93df176db4b.png,"A black backdrop highlights the ethereal beauty of a floral-crowned woman, her serene gaze."
0744baa09fb7d9f9d44bbe9bdf9a8671.png,"A close-up oil painting of a woman's face with intricate African-inspired patterns, intense blue eyes, and a bold red mouth, centered against a solid black background."
915b2c61da8a2b35836fb7bea617d1b5.png,"An ethereal, fiery tiger roars in the forefront of a dark background."
7f4f70d8db7f14fced19e1b94ac522e1.png,"An elegant, colorful bowl of indulgent treats, carefully arranged."
29e26ad2cb46f17224e543276e152c19.png,"An epic, chaotic movie poster of ""The Forever Purge"": Warriors prepared for battle amidst a fiery apocalypse."
f87c695126a1bf06f4eb02af3ff4307e.png,"An futuristic metropolis, a large robot with flora adorned, stands tall. Red eyes glow, a living contrast to the mechanical form. Behind, a bustling city, a blue screen towers over the gray haze. A lone figure adds scale, a human element, inviting interpretation of this harmonious fusion of nature and technology."
978359ab7f6c9ede50e508089dc866a7.png,"An epic, stellar panorama unfolds: a grand portal, adorned with intricate patterns, looms large. Two tiny explorers stand beside it, gazing into a mysterious new world."
e0108cbe8beba2b6197f075bea47a6d3.png,"A stunning portrait: Confident woman with blue eyes, floral headpiece, and elegant blue dress."
98cc1cd4cc72e9521488ff81781a0644.png,"A colorful painting of a baby holding a labeled milk bottle, eagerly awaiting nourishment, on a vibrant blue background."
ef9d5747f22c8e8f946d51e237f48f72.png,"A joyful woman in a red cheer uniform, smiling, stands in front of a red building."
