image,short_prompt
709d3b2ab0007f337e6c0e5e737b3bfd.png,"An epic, awe-inspiring vista of a blue and orange nebula, illuminated by starlight, against a vast starry sky."
bffea9c50f36438168578e23aa505321.png,"A futuristic figure, clad in vibrant attire, stands in a lush, colorful jungle, gazing upward."
7254a948931acf482cb9c59a3acf7cbd.png,"An evocative symphony of violin, dual trees, and majestic mountains, bursting with vibrant hues."
e550eb259d827f082f7fb92b68d79379.png,"A detailed pencil drawing of a focused woman, central, with wavy hair, glasses, and a tattoo."
c8349d33808b409136c48569c3f47380.png,"An ethereal, surreal landscape: Blue tree on a beach beneath a hexagonal sky."
4462e78e5249f07ad5fda213241ccdca.png,"An ethereal, serene watercolor portrait, featuring a dignified Middle Eastern woman gazing at a vibrant sunset cityscape."
ac3d6ebddb4079b3ca9f0b3d3f86c148.png,"An illustrated map of Africa, vintage style."
d057f65ab91d309e5d4456ff3947cfe8.png,"An awe-inspiring aerial view of a majestic castle, nestled in a lush mountain landscape, bathed in warm light."
75bd6f993ddfe38c5c099301da60b65c.png,"An ethereal, Gothic cathedral, a vibrant woman reading adds a modern twist."
ae40f85a0cda1a5c1ffc0055685f9094.png,"A turquoise-toned lady in a circular painting, crowned by nature, surrounded by intricate gold patterns, and balanced by black, with downward-gazing eyes, amidst tranquil white butterflies."
77b86f117933ac8a638cd83b2e1fe425.png,"A vibrant raccoon leaps against a starry night, surrounded by a burst of orange and yellow, set alive against a deep blue sky."
b7735057921b6991e56cbd1a49e9c936.png,"An ethereal, golden pyramid in a starry desert, alive with cosmic energy."
15a0d1ffa3dfb3ea4e610baec275feda.png,"""A comic book-inspired duality: Batman's mask in B&W with flying bats, split by The Joker's colorful, sinister face."""
a7355996d8a64766e8ce9c14d3d9dba0.png,"An epic, sci-fi desert landscape with a central, intricate pyramid and a celestial sphere."
1c0f21e85343af800af0563fe7ee2f38.png,"A warm, vibrant bar scene with a stylish rat enjoying a drink."
00baa926b3ab1e034683bf051da44c5e.png,"A lone figure on pink-hued mountain tops, gazing at a vibrant blue and green planet, with swirling clouds and a warm glow."
f1d7b01d050ccebb8128bb3f827deca6.png,A digital art piece: Future cityscape with a futuristic car and a mysterious figure.
711e48cd908b703ca6fc072983fbcfed.png,"An ethereal, serene blue and green landscape painting, with majestic mountains, a winding orange path, and hidden settlements."
503f498f15daa708c8c64468237fcfe3.png,"An ominous warrior, armored, prepared for battle, stands in a mysterious future world."
7a882ae933f0ad3a5888fc46622bfc6c.png,"An futuristic architecture, a glass and steel structure on a throne of rocks, deep space mystery."
c8be96a83ef87315d81cd4015cea3611.png,"A bold digital art portrait: a blonde man in a leather jacket, intense blue eyes, centered, against a dark background."
2d35d0688eb81ca15275136ae067c114.png,"An ethereal, illuminated cheetah cub amidst rocky terrain, captivating and serene."
f74c93a4dbbdbade74e3824136e2f5dc.png,"A warm, low-angle portrait of two women in vibrant dresses, gazing downward at something off-frame."
e45d10cd5de646410594a5948a1627f2.png,"A serene digital portrait: Woman's profile with hair of nature, blending into a lush landscape featuring an overgrown castle."
deb8f8e9b26352b646419d7f782a16dd.png,"A digital artwork: Woman adorned with leaves, nature contrasting urban decay."
2464f58db79ebb302d3c18b5d84e1aad.png,"An eclectic gallery room: Square painting of multi-colored squares, a blue, yellow, and red patchwork chair, and a matching pillow."
06acf7c268f66c8a8a4a914c0deb751f.png,"A majestic fox in a Greek toga, crowned with leaves, sits upright on stone; noble, wise."
87201c849f4489304df69f1236638eac.png,"A studio portrait: Close-up of a woman with intense blue eyes, soft, parted lips, and loose wavy hair, focusing on her expressive face."
b201f633797db44cf9513a8551d515a6.png,"A tender monochrome. Woman in white cradles a black bird, a moment of quiet intimacy."
0acbc88d31b63ff6fa16fb21bb71e76b.png,"A portrait: Serious redhead, backlit, in soft focus."
4cf7175231717124a88ab686e2eb119e.png,"A confident woman with vibrant red hair, dressed in a gray jacket, stands in a well-organized technical space, lit by a warm glow."
196a52a45fc768b5c151495d9cd376fc.png,An atmospheric sketch of a medieval town's bustling street.
2c06466021c04937edd89167b052d15d.png,"An energetic, playful scene: a man and giraffe chase in a bright, rustic glass-roofed building."
34bfc79011b188fcfe57ff36b10b5ff2.png,"A charming rabbit sits in a basket of vibrant flowers, fixed on the viewer."
fe60353d79a6f75e1131ccbba231a603.png,"A vibrant watercolor portrait: a young woman with glasses, a green jacket, and a lively ponytail set against an abstract, colorful cityscape."
a6cdce9616c1de568ad286977440add8.png,"A dynamic, central composition of Captain America's shield, awash with vibrant, splattered colors."
92c07479a0451e3b4ae107a529439342.png,"""An intricate black and gold Yin-Yang symbol mandala against a solid black background."""
8c6cc2478bd99541fcb32c6305f0d712.png,"A minimalist's dining room, bathed in light, with nature as a guest."
deb924e96fe0013abb18b3d401dfee76.png,"A dynamic digital illustration of a blue and orange velociraptor, its fierce head turned right, contrasts a dark background."
c19592e3f844fc4e34c35479d5c077e9.png,"A detailed, static illustration of a shield, with a crystal at its heart, emitting a soft glow."
3521bd5984858ebacbcfe0c35f3140ff.png,"A reflective moment, two generations reflected in mirror symmetry."
f8f3c5da793e5a6fbd00919ab43c6e96.png,"A majestic wooden creature standing tall in a hazy forest, its branches forming a majestic crown, eyes glowing with a mysterious green light, and adorned with vibrant green leaves."
9c450d37131dafdc2df7fe2b585a55ef.png,"An intense, realistic portrait; an elderly woman's face and neck, adorned with surreal vein-like patterns, against a stark black background."
85050d47ebe72e93bebb0e5edbaa3d2f.png,"A portrait, central focus on a young woman with white hair, calm blue eyes, wearing a black jacket with blue and red accents, against a gray background."
20463a4fcd3b7ae9cb07eb0134880c7a.png,"A futuristic portrait of a steadfast woman with flowing white hair and intense blue eyes, featuring a blurred cityscape."
11ea7e046b4c1624f46c7c1647639ed4.png,"A sci-fi scene: Robot in a futuristic glow, contemplating a vending machine."
a4b407e6ca2ae1df404e003d27aa922a.png,"An awe-inspiring watercolor scene: a blue and brown mushroom, water-soaked, surrounded by harmonious blues, beiges, and browns."
6decda2c10ba39d3cf947f448cfdd9c1.png,"An idyllic village, a young explorer's serene path through lush green fields."
d4f1a9663f06a4df0fd27d7178b2b926.png,"A heroic Yorkie in a vibrant military outfit, striking a confident pose."
8054212fa6120c9b425a2f5f5afcfa47.png,"A striking black and white butterfly, its intricate wings taking flight in the center of a minimalistic black backdrop."
acea5e67b5d8b0eaf25fc85779caff98.png,"A black and white butterfly, intricate and symmetrical, against a solid black background."
98e85369fc528559c5a7cc8a7d355e74.png,"A portrait of a curious young boy, vibrant hat, sharp gaze, rustic setting."
a906fe0588923357187a7e2692a793ea.png,An otherworldly patrol stands vigilant in uniform green.
b217b4c2f09acb5cb81bef802eae16d0.png,"A whimsical sketch: curious mechanical mouse, with intricate gears and a reaching posture, set against dark gray."
b12037dc8b34e17aab2c895131a6ecb7.png,"An intricate coat of arms; a grand shield with a majestic golden eagle at its center, surrounded by colorful birds on flags."
214de3167b1fc89ce69d569f93bd925e.png,An intricate watercolor portrayal of a vibrant mushroom cluster.
e3fd71a621b2ffa80197494c30fdaadd.png,"A white background highlights the colorful mushroom garden with a large red and white spotted mushroom as the focal point, surrounded by smaller unique mushrooms and orange-pink flowers, leaving the name ""Maamraameelami"" as a watermark."
ef708cecf3e42a4a8734019463069be2.png,"An elegant, fish-shaped car with intricate details, ready to swim."
9d7c8d748887dd245b7388af2c85c564.png,"An aerial view of a vibrant, neon-lit labyrinth, 3D digital art."
c59615e1988dd8b1cd555b8c90c686a8.png,"A whimsical oil painting of a crowned dragon, with vibrant hues, perched on a gold-accented pedestal, connecting with the viewer."
fd9c412b737bea7ec186ef74dec87e30.png,"A striking portrait: Man with gem-like raindrops on his face, vibrant against black and purple."
59cf9ba91531d1a8834aa33923a64f0e.png,"A square portrait painting of a woman with a blue and gold headscarf, elegant and harmonious."
617e3eb2ecd27f175283188eaf0a7f2e.png,"A symmetrical, regal portrait of a woman adorned in vibrant African attire."
6214297c844262cde8e1bafe0458d2f7.png,"A bold, dramatic DC Comics' Batman, lit by blue, stands out against a dark backdrop, determined and imposing."
a6f475559ac81cfb1c87078c459d33dd.png,"An illustration of a plump bird perched on a forest branch, gazing right, surrounded by an harmonious brown and green blend."
806c5601f3d9d0c1f729db3b33bde3ea.png,"A vibrant, dynamic mushroom cloud reflected in water."
76fc411e0ceecfbd8338bb0975820931.png,"A serene nighttime sketch: Majestic tree in pond, glowing pink, wooden buildings, inviting light."
0dabe93b4f17b57f2688e89c47cf1997.png,"An ethereal, lunar-lit stone castle, intricate in detail, looming large."
640ccbae3366c10e318efcd34e0b2a39.png,A close-up portrait of a blonde woman with a determined gaze on a dark background.
8e5253667a96691dfc760ec3f8953262.png,"An inviting, modern black house in a forested setting, with a deck and pool."
fbd398f0d85068c7c2bd956e0cdb5283.png,"An appetizing close-up of garlic bread with herbs and cheese, ready to be devoured."
5c339460e84925ea606aec593827f4e2.png,"An orange-suited astronaut boy, drawing at a desk with futuristic views, contrasts a vibrant, space-themed room."
94f00d1dc3c1a90b632378672385d2cd.png,"A lunar-lit Gothic town: ethereal, mysterious, and eerie."
d1035062e60651a8716e9ee7532bb004.png,"A futuristic blue and gold robotic hand, elegant and detailed, holding a gem, set against a dark background."
39f3ce3ef2f84b9342f003ee3e0df5b3.png,"A realistic digital illustration of a young woman with blue hair, adorned in blue and gold, invites viewers with a gaze that connects."
a9c0b1c89878d16b42bee346212a4ad3.png,"An evening sail, a peaceful scene."
5d9570b353cd1c3b77cfcc5ee9ca0883.png,"A vibrant, digital portrait with a colorful drip effect, set against a dark blue backdrop."
5e969eae79abc20baafbda88ff3738e7.png,"A whimsical forest creature, centered and posed, amidst an autumnal arboreal scene."
2a0311247f72c1e5972925990a00eb65.png,"A calming blue bedroom, a gamer's haven."
18e576b8dafbc8d6ba983f80be061f4a.png,"A beige backdrop showcases an upright black takeout box with gold accents, featuring intricate dragon and bird motifs. The box teases a glimpse of its culinary treasures through a small window, invoking anticipation."
1d847ce8de3d752647bfe4217715f7fc.png,"An ethereal, kneeling knight, centered, with blue and gold armor, wings, and a sword, set against a dark background."
17eca8c0e6b7ba921cd6a7f36f4e886e.png,"A powerful, abstract wave of blue and green crashing in a digital illustration."
257b8db69d0a3b8caef32982eb27cdb8.png,"A dark fantasy digital illustration of a woman with luminous red eyes, ethereal in white against a dark backdrop."
5be60cfd245c783c37ba3ed15c8e5368.png,"A futuristic timepiece held in admiration, its blue face glowing, intricate, and classic strap."
b062e4ef4e8c83d9e95c05b5d092776d.png,"An intricate coat of arms; a shield of red and blue with a golden lion stands out, surrounded by a wreath of green and yellow. Regal and symbolic."
b59326294589be7eb9d112cb7caa98cb.png,"A majestic steampunk butterfly, its intricate wings spread wide against a black canvas."
f35f46873ce9a35d214eef0a16a87f4d.png,A futuristic portrait painting: Visor of wires frames mysterious blue lenses.
be0c8bb12e9311a190e4aeaa9efe752f.png,"An awe-inspiring golden spaceship, with three smaller vessels, orbits in a futuristic scene."
842bf09602464ce80a501c34f33f71bc.png,"A majestic fantasy creature, adorned in intricate gold armor, stands on a circular pedestal."
376ad40a3b4776b2c7904192c08e4681.png,"A dramatic Mortal Kombat character, centered, clad in a black and gold hooded cloak, with a intricate blue and gold mask, stares intensely at the viewer."
ae4a13e628f929632e63316ad5421e67.png,"A portrait with a focused young woman adorned in a floral sweater, her gaze capturing the viewer's attention."
d680c4c328b72d980bdc2fc99210c0e0.png,"A vibrant, winged figure, armored in blue and purple, stands out against a soft gray background, exuding strength and grace."
263546c1ae61498396e07a3eae19fca0.png,"An illustration of a joyful girl and her modern past-time, set against a bright canvas."
c8cca2a299dc2e46c017cbf1d6da756c.png,"An ethereal, blue Gothic-style pocket watch floating against a dark backdrop."
178ef6dac10ae0327b86da99f28ad1df.png,A close-up oil painting of a thoughtful Japanese woman in traditional dress.
898c3b08eb5a1a23f308c5790bc2b5c9.png,A detailed and enigmatic black metal wheel with a central skull.
1ec59fb48a5666549a71981b5c1894a2.png,"A peaceful garden sketch: Two figures, blue & green, amidst vibrant flowers."
9b751da8077f3c62f2cbbf3912630fb7.png,An abstract painting: Warm harmony amidst ordered chaos.
6d50bb6ccfc6ed240ca61eb25290c664.png,"An Egyptian relief, three women adorned, lively poses, storytelling."
c7c79d58b3a2d2a930fa22139da10d52.png,A futuristic steampunk machine in a desolate landscape oil painting.
7233f91f8670bf7d73d996aedef9afdb.png,"A serene woman's profile, elegant and warm, with impressionistic brushstrokes."
d6aff41f848df95a7403806c51f0471b.png,"An futuristic urban sketch: a blue & white robot with a spiky back, rolls on a street lined with buildings."
f01aaf866ddd47dbf128056637ad8164.png,"An abstract canvas of white, with explosive bursts of orange and red."
30a0b0a76d5c644f9f05e895119fe0b4.png,"A symmetrical mandala with a golden circle, vibrant smaller circles, and intricate patterns, surrounded by a nature-inspired black border."
14f53bc8f54c484748df97d373d60462.png,"A detailed, digital illustration of a vibrant owl in a mystical forest."
fae39ab4d638b006639353d4f3fec89a.png,"An ethereal, futuristic desert skyline with a neon-lit building, dual moons, and static cars."
1e807933658314b6540074dc0df85191.png,"An adventurous vintage portrait: Indiana Jones, a man of mystery with a snake."
a621bcb228003cf09280b5ac1f7a0249.png,"A detailed pencil drawing of a Ferris wheel paused in creation, with intricate details and a bustling cityscape."
db281421608a74c5c026a418f1a6f3bd.png,"An ethereal, nature-infused portrait: A woman with flowing turquoise hair, adorned with a gold necklace and a crown of leaves."
5b4431cf0b8eb428521dff95cd7eade0.png,"An ethereal digital illustration of a red and black space explorer, gazing into the cosmic crown adorning her skyward face."
5c1bfdc5b72838ac352bbaaa5759ec3e.png,A detailed and inviting sketch of a person delicately sketching a celestial astrolabe against a starry night sky.
887b8622ddf9e80d46302afaa6e4bc3b.png,"An aerial view of a vintage plane in the desert, emphasizing its size and solitude."
c96a4f4b52cb1e97bed12ae7a44228cd.png,A majestic Great Pyramid of Giza beneath a starry Milky Way sky.
44844d1e4e4b3178a558daaf0cbeee46.png,"An epic, otherworldly scene: a robed figure stands on a rocky alien world, gazing at two vibrant planets in the night sky."
73ffd45c5a584f513fbb1dcb48de7a16.png,"A majestic rocky formation, alive with nature, under a starry sky."
52bc49321bfb354064fceaba8a9b6a9b.png,"A serene, aerial view of koi fish, balanced & surrounded by vibrant flowers in a peaceful pond."
ac74aef979af76aa2adce662a124ac28.png,"A futuristic woman with a digital city jacket, reflected in blue, stands amidst an orange and blue backdrop."
2faa1aca587f8ec3515278ed667397a3.png,A girl and her bear companion in an autumn forest.
0fd2bb42b87e0c330e0a36cd8426c3b6.png,"A vibrant, rainy city street, alive with neon lights, silhouettes, and Chinese signage."
86601ed566d19074440376e8840a12d8.png,"An epic, awe-inspiring mountain landscape, inviting the viewer to stand in awe of Nature's grandeur."
436cf69ccc88427af6f95d75332a5a86.png,"A black and white sketch of a floating woman, serene and ethereal, with a hint of colored patterns on her dress."
d15d799ef081d56a7a43da53108221bf.png,"An imposing concrete structure, modern curves, serene park, autumn hues, low-angle view, harmonious blend of nature and architecture, muted colors."
666fb3cc5a8f3e2df320e51187d11096.png,"A cyberpunk city, a vibrant, futuristic world thrives with a young woman in neon lights."
7c0e3946e8240ca4a14ca8ce7bd1b72f.png,"A serene mountain landscape beneath a starry expanse, bathed in soft light."
7f680c9cb0563c0b84d77824aed5aa8e.png,"A dynamic, flowing vision of a woman, her white dress billowing, in a stark black void."
21587ad9bbc872eb923c9f3d2e5a5db6.png,"A serene oil painting of a woman in an intricate white dress, amidst a white and grey serene landscape."
976501ebbbf101f351f43492a1ccf1e1.png,"An imaginative, whimsical painting: a cat transformed into a vibrant cheeseburger with a realistic burger bun, sandwiched between dark gray and white bread, served on a dark background."
69f71c74bfe91f770bbefeb52fd11df4.png,"An illustration of a powerful woman in a dynamic pose, dressed in a black catsuit with silver accents and flowing hair, gripping a futuristic weapon. The vibrant yellow background complements the mechanical elements, creating depth."
6055fd3aef01bfae6d98766324dc8261.png,"A majestic, blue rock formation crowned by a solitary white tree under a starry sky."
5a7db9519b1f5ed95890d17f5cb04beb.png,"A vibrant, digital enigmatic character with a fantastical mask and coat, against a warm, bright backdrop."
7774af72ab9b26182d519e2f90c3645a.png,"An ethereal watercolor panorama with amber mountains, a golden sun, and leafy trees."
46a280b425679cab7dd34e3ad7d5ed61.png,"An intricate portrait: A young woman in traditional Chinese attire, serene & centered."
607d20c8f7ff804d931ed7fb57b15dd5.png,"A heartfelt forest encounter: Girl and bear cub, muted hues."
378be50f4536593a3ebe93e0f4dda089.png,An overhead mirrored disk reflects a desert dreamer's starry contemplation.
d2dff499be294f8c04f90218610eb703.png,A majestic digital portrait: Woman with horn crown & gold mask against deep purple.
9368655a08055103a9f9d5c6e0c89834.png,"""Energetic portrait with vibrant hair, bold makeup, warm background."""
43eae4c9be0a3c8391c0e09b10ecac2f.png,A digital art piece: Whimsical woman with cascading blue hair gazing off into the distance.
91b7981473c85eda566db82aba6306dd.png,"A mystical chamber, centered with a figure adorned in purple, amidst an array of enchanting objects, with a celestial ceiling."
c1b0c7b3b16e17c17f407b78638a6fd9.png,"A dreamy, ethereal oil painting of a solitary tree adorned with pink and white flowers."
e187c8b98e3a68d1a54539b558874ce1.png,"A majestic ram, fur detailed, horns curved, stands rocky outcrop. Serene mountain lake, starry sky, calm."
655dce881173642c983a7622d8571e74.png,"An ethereal, majestic ram against a dark blue backdrop, bathed in amber light."
506987ca3a2cbf08918ae17ac9bce888.png,"A serene canine amidst tall grass, a red collar contrasting its black fur, gazing into a stormy sky."
d80832f49f6a195f50c3b965109b0c95.png,"""Enthralling journey: Girl on dragon's boat, amid clouds"""
c700965a3d4841416ebd5c19197d5b3a.png,A humorous office scene: Suit-wearing cat focused at its desk.
1defbfaef5a24620c0c9031839bf339f.png,"A vibrant, dynamic digital art portrait with an abstract, geometric background."
b38adb99652c69c1e193b3bcb9067cbb.png,"An expansive, serene wilderness landscape, water's edge in the foreground, lush mountains in the background."
12c8f29cf184e1a142848f5ee06f1197.png,"A confident young woman in a blurry earthy-toned world, ready for action with a touch of sophistication."
02a23d08d0f49ce3c30b0ad207380e7f.png,"An ethereal, dreamy photograph of dancers poised amidst ancient, weathered ruins, fusion of past & present."
3807ead6abd5b7b4b67a9469442f4f56.png,"An intricate sugar cube city, a towering temple as its heart, on wood."
7ebdf2d211b064dadc428dbb120c5776.png,"An orange and blue cartoon jellyfish, smiley and swimming right, in a bubble-filled underwater scene."
45271e519eba6026e455aaa2975c6560.png,"A cave's heart, a tiny gray-hooded mouse's adventure."
2959d93105700dfeb44fa82e3e60e091.png,"An ethereal, ornate headdress of green and gold, a central focal point."
4c6bf6eab12b8608f01483954aa10a28.png,An ethereal oil painting of a girl riding a vibrant dragon in flight.
72ac5757d1ba369e841e4fd3ae6eb030.png,"A serene, opulent dinner table tableau with subtle symmetry."
07ab4d2a9ab38fa58456cca5324c1c38.png,"A black and gold 3D rendering of the letter ""K,"" crafted from an intricate mosaic of swirling, moving letters, exudes harmony and dynamism."
2661cf36a674846675a436ae34475985.png,"A dramatic, industrial stairwell scene: two determined figures, one descending, one ascending, in suits."
f35c84a1086b4f96d27c0574b3ce9f8f.png,"A blue and white oil painting of a woman relaxing in a hammock, surrounded by a toile de jouy pattern."
1d7e287fc6084cd32281e631bc7cd928.png,"A serene blonde woman overlooking a city in whites, blues, and grays."
143dd14a4dacbcda2e5a34c39cb8ca0d.png,"A cozy home studio lit by sunshine, a focused seamstress in a vibrant yellow dress creates with her unique sewing machine."
8d5dc7c373ac6038ec1525fc01db06fb.png,"An ethereal, starry vista with a majestic archway, ram's head, and serene mountainscape."
564c0dd230e30270fbd704ac5ae043d0.png,"A close-up digital illustration of a mysterious woman with orange eyes, softly lit by candlelight, amidst a dark background."
d9872b574932ee44c17e1f61f8eb001d.png,"An serene, lush forest gazebo, aged & reflected."
f6eb41fd03aaa9c6c9b389067aa66730.png,"A serene, plant-filled room, blending nature and science."
4080e464dcf3eda2574a3d7553ec78ff.png,"A futuristic, ethereal scene: floating islands with majestic castles and solitary trees, against a gray sky."
62cca405263fbe90faef97f57544a41f.png,A close-up of a detailed moth on a red backdrop.
f93a7e3fe04af1201b6cff29ef9f1ea6.png,"A majestic stained glass portrait, featuring a royal blue and gold woman against a celestial backdrop."
4829b290f3ec217e63f1570843c6153d.png,"An ethereal, colorful stained glass window depicting a regal masked woman at its heart, encircled by a symphony of mysterious figures."
ab7bd9ced579bb9b6a54a11f187c51d3.png,"A stained glass portrait, featuring a serene woman in blue, is enclosed in a dark frame."
49d3f46c5b479c468c924386c7d031df.png,"An ethereal, regal woman in intricate black attire with metallic wings, set against a subtle gradient."
f7f08153d267015a1a05101d6cd7b669.png,"A lively dinosaur, mid-dance:  charming, colorful, and playful."
e13213e27c5be60168becf6198d48a49.png,"An adorable space explorer, clad in a starry suit, stands on rocky terrain beneath a serene night sky."
bc51266203515a4f8c0dbd2e94ef88a8.png,"An epic, sun-drenched medieval castle illustration."
991c7681bc5e3f1b9cdeaa8b96c34457.png,"An enchanting scene: a boy, dressed in white, stands before an arched gateway to a magical forest, inviting adventure."
2da718b733141a6fe50a8496932f19e8.png,"An epic, fantasy castle perched atop a colorful, swirling hill, inviting viewers into a magical realm."
8dffc929c7a4ea041cbef1a819cfb005.png,"A warm, rustic bar, filled with character, where two friends in hats enjoy coffee and conversation."
bfbd2de221f8f56efc9694245cb89494.png,"An evocative, fantasy-infused scene: ""Lighthouse on a cliff, swirls of blue and orange, figures at dusk."""
29dabecaf4bc03c366f0b531043c5e42.png,"An illustrative portrait in blue and orange: a determined woman, adorned in a unique jacket, lost in thought amidst a vibrant cityscape."
1d92c73cd59bad3e136c3b3ee55f7c08.png,"An ethereal, surreal river scene: nature's enchanting adventure."
a1315a2ac39c42dba075f893d6b14bd5.png,"A mysterious, elegant woman in a lush green and gold outfit, centered in a black background."
c4590834ee2581454c7a1fded7662036.png,"An ominous, grand castle, with three towers and a central gatehouse, stands tall against a stormy sky; a resilient, ancient fortress."
406c8af6f143240e17bf3abf1ef44bed.png,"A golden tree of intricate roots and branches, framed by a dimensional circle, in a still, harmonious composition."
45bcc294f4dacf508f14b9c419f84030.png,"An elegant still life: Luxurious dinner setting with intricate centerpieces, awaiting a grand meal."
d103915fc4ddb1672975a6d7c50c2284.png,"A festive globe ornament floating amidst a Christmas tree's lush greenery, housing a serene miniature landscape."
