image,short_prompt
6d715eb3965dace7830e891a0b310852.png,"A colorful robot braves the storm, sheltering under a vibrant umbrella."
d05176c15ef39412b6ed604624874749.png,"A portrait: Serene young woman with vibrant pink dreadlocks, against a deep purple backdrop."
7b6416274c32c6079fed9cf27ca2c6dc.png,"An intricate 3D sphere, red, with feather-like patterns, against a black backdrop."
44e925432c6d5ffd69737bbeb84c775e.png,A warm and inspiring internal shot of an artist's studio.
62ed216fc84c76de0f14a2b152f5b62d.png,"An ethereal, blue-hued throne room, focusing on a mysterious, hooded figure seated on intricate ice carvings."
8a8b88003311d59bead3be5950315837.png,"A black and white photograph of Lou Gossett Jr., side profile, pensive and enigmatic."
baa25c9c7c10256ef27b6d6cfbab0763.png,"An orange and pink hued sky frames a pilot tiger, adorned, determined, and ready to take off."
8837cc09b4876bd220dc54e70741f840.png,"An atmospheric, serene painting of a wet, winding road, surrounded by lush tomato plants, leading into a mysterious, fog-clad sky, inviting tranquility."
30652e73fb8eb04267ec0a4e930debf2.png,"An oil painting of a colorful, floral moon with three vibrant birds."
0870a509f500d64a25bb5573b2c4cd3c.png,"A 3D rendering of a playful teddy bear, dressed for adventure with swords, set against a soft pink backdrop."
0cfe5e29a2a0f42811e69339511989c5.png,"A vibrant, detailed skull with abstract flora, centered and contrasting a dark blue background."
bc37685873b146bdbb2f3250ae601b22.png,An intimate charcoal sketch of a pensive elderly man in contemplation.
88707c6a03ef2db17230eeb2acde2824.png,"A striking close-up portrait: a woman's dual-colored face, blue and yellow, gazes directly at the viewer with a powerful, connecting intensity."
a7ea65a7e0e280ef43148da27e17369e.png,"An ethereal, symmetrical floral symphony, emphasizing two central blooms."
1e0408af158344c31d043b20414944e9.png,"An illustrated warrior, shrouded in a patterned robe, poses against a columned white wall."
3d70f40ee2dfeb7ff5c1fc15fe7bff6c.png,"A ethereal woman in a black hooded cloak, her intense green eyes capturing the viewer's gaze, set against a soft, blurred background."
96492298e7cda6a95ef55c98ca57d294.png,"A bold, detailed digital illustration of a white Stormtrooper with intricate patterns, striking a dynamic pose against a dark background."
ee0a06e16f6050a8cf584587b6eb01d5.png,"A fiery spider stands on rocky terrain, blue eyes piercing through a dark, smoky atmosphere."
c2ca13d1a952ff7cfdd5d050744b0808.png,"""A spiritual portrait in harmony: Woman's profile, vibrant backdrop, serene expression"""
e1557027929d8d50c3349a4ca778f4cc.png,"A vibrant carousel's blur of pink, with a blonde woman gazing directly ahead, calm amidst the rides."
59c30df0183f99d7daabc8c491c027bc.png,An ominous medieval battlefield with armored knights marching towards a wooden gate.
2e2a72892f1f0373dfbaaae6326a6999.png,"An ethereal, mystical landscape hosts a majestic blue bear-like creature, horns atop its head, standing erect. A small figure, awe-struck, faces this majestic beast."
421a369147237c11e93f638fb0a21a23.png,"An ethereal double portrait, split by contrasting elements of fire and ice."
24f35f348271f3f1c30f29ded3bf87c4.png,"A majestic queen of ice, her frozen features and hair contrasting a darkening background, suggesting winter power."
2dd8116b5bfcffa8a5a0f36ab6a470e9.png,"A futuristic structure amidst snowy peaks, a lunar glow illuminates the tranquil scene."
579388ce426684cf001f6602d859f9dc.png,An orange sky shines above a girl journeying on a white whale.
7d6889f42499d614219807b23dd738e7.png,"A minimalist's Japanese garden, with a large circular window, a serene portal to a world of nature."
8d7ca247710d4f3e1ea8a6735f896f01.png,"An expansive neon-lit cityscape painting, viewed from above."
584913320a37a4e1e609c6d7ef58dab6.png,"An adorable grid of sixteen unique cat faces, Kawaii-style."
bdb6d85631318cbb89773a4d93bf5e75.png,"A realistic watercolor painting of a central sea turtle with a patterned shell, swimming right, surrounded by whimsical dots."
76169296338f62ca09cfc48ace2dab42.png,"A colorful, dimensional still life painting of a burger feast."
4a3f7877c503d2a4294ca724fc3a4d09.png,"A stunning digital eye with vibrant, swirling colors, geometric patterns, and harmony."
a09d28e81c175ee49cd43e894abcf68c.png,"A majestic blue and purple dragon with green scales, horned, against a dark green background."
6d959f6bd981b69a1b2e1cd489f74ed1.png,"A dramatic mural of a cosmic galaxy, with an absorbed artist illuminated in the dimly lit room."
96ae9b6075ba73c300f62ec562a42276.png,An enchanting treehouse painting with whimsical details.
1b0d4fc174d38839fd89e932de4658c8.png,"An ethereal, serene interior garden oil painting."
7a20dbe2c187167b6fe8f425dcf996e3.png,A lunar-lit metropolis with enigmatic structures beckons adventurers.
78718e3937d9490eeedf65686d0387e7.png,"A bold, fiery warrior, determined and adorned in red and black armor, stands out against a stark white and red gradient."
5c845180ff38c091d4782c63aaa07f12.png,"An ethereal, ominous forest; a figure cloaked in luminous foliage stands tall."
72baac4a88991a29072ff50e940c8db1.png,"A portrait: Young girl in Black & White, Mysterious, Illuminated."
f777a2b9b0965b61ab4c669ed669048d.png,"An illustration of a whimsical candy land with a vibrant pink sky, where a mountain of treats rises above a pink house and a floating balloon."
80f803c29bee73cdcd2dfdac7b3464d7.png,"An eerie, fantastical forest, a lone traveler with a luminous backpack, and a striking lightning-struck tree."
2c21dba19c2fdd172e7184df76c07dcc.png,"A vibrant urban concert, a green mouse plays bass, ""Rat Kizs"" shines above."
c07a1adcdcd5f78003a4ea126820210d.png,"A futuristic soldier, a solitary sentinel in a leafy black forest."
296116067e3887290792b409cfa9744a.png,"A large, vibrant flower with intricate details shines against a black backdrop."
846cc8fe3eb03afedbd63e64e4257101.png,A digital art piece: A woman in glasses holding a blue book amidst a futuristic background.
2713a440d227792b45a2808bdcf226a1.png,"A futuristic scene: Three spherical drones in a symmetrical formation, each adorned with red and white lines, float in front of a monochrome cosmic landscape, featuring three planets of different sizes and colors. In the foreground, a tiny human figure stands on the largest planet, adding a sense of scale. The overall mood: awe and wonderment of space exploration."
bceea91e6314e10cb285487ff4cdd099.png,"An orange-hued, digital illustration of a tall mushroom with intricate patterns, surrounded by a fairy ring."
f4d0d5e6bd966e90b3054f08d23378b9.png,"An intricate digital emblem: Sunburst, stars, flowers. Gold border, black background, balanced."
e134fdff55c3bd134a258a5e0ce3345a.png,A striking steampunk fusion: Orange poppy encased in a mechanical frame against a stark black backdrop.
e748393c6b5615353f5a59846bc111d6.png,"An ethereal, floral lion, vibrant and static, faces right, amidst a white void."
d5c4e3c9e6c0677695fa10a06fcf8af9.png,"A majestic, resilient ship navigates the icy wilderness."
8ae2110a7e3058636468c70381a81dbb.png,"A bold, futuristic cityscape with a confident figure, vibrant colors, and a mysterious light vortex."
e7e9bae77d789ee9f6d8d72a9b129335.png,An imaginative kit of gladiator kittens: each has unique attire and weapons on a dark stage.
6ff5c2e197408acd37ba3be8a8a6d60d.png,"An ethereal, surreal scene: a shrouded figure stands in a field of yellow, their hooded robe a continuation of the vibrant flora, reflecting a serene unity with nature."
242fe0e8dc8420fcc6f1946d5e92c11d.png,"An illustration of a vintage robot, white and orange, with large black eyes and a speaker head, against a plain white background."
48464b5862f0bb4a84b34f78104d4144.png,"An enchanting, sunny winter castle nestled atop cliffs, surrounded by an awe-inspiring mountain landscape."
98d5324435281865a97beaa6159f333c.png,A desolate snowfall scene: lone figure pondering a large clock's mystery.
e8d4001b7808942c37fa5d407331ef71.png,An ethereal purple cat lounging on a yellow crescent moon against a gray background.
00a89c1729664706842d02fc28f92191.png,"An inviting, modern living room with a vibrant blue sofa, pink ceiling, and lush greenery."
129f3616af1c123ed9913cd56933387b.png,"An epic, untamed frozen wilderness, blue and white, with a mysterious ice cave portal."
cda92087c134dd656038e7a4e4198a8a.png,"A dynamic red liquid bulb, splashing and flowing, asymmetrically positioned with black cord contrast."
f4cd0809f01a9a37950fb700120adeb3.png,"A towering urban decay mural: ""TEXT IS HARD"" on a crumbling building facade."
4407532001999caf808b2c36a8de89da.png,"A black and white portrait, a woman in a blazer holds a sword, her intense gaze capturing determination."
5fc895a9bc27d495b34423bbf0df3242.png,"An futuristic portrait, a woman in a white coat on rocky terrain, amidst a pink and orange sky with encased dome."
0b7a9e06bc9b8f3df615522f372c7726.png,"An ethereal, moonlit garden: A young girl with blue hair sits on a white flower, surrounded by a circular floral frame, radiating curiosity."
3f2920ebc4cfc1d17533fe82bed6c52f.png,"A digital illustration of a woman standing before an egg-shaped structure in a surreal desert, adorned with intricate patterns and a glass dome, amidst a cosmic sky filled with planets and moons."
c2dd925a7f2aee3e81adfefa2a15f736.png,"A black and white illustration of a creatures' startled encounter with a raindrop, frozen in a whimsical style."
0d6e49d83531e231749b2af7bbc0007d.png,"A detailed winter nail art masterpiece, five miniature landscapes on fingers."
69498d1a9b09cbfeadbc6d340d95c554.png,"A dramatic, golden masked figure, lit dramatically in a dim room."
2499e256eb7ac2037bb538b345016aa5.png,"An ethereal, desert-hued portrait: a gray and pink bird adorned with a purple flower, crisp against a blurry backdrop of its arid habitat."
4a179488a615111fa6373be13b0a5241.png,"An ethereal, tilting heart-shaped geode dances against a dark canvas."
09f6d99d902f7571ef104f4d6953e922.png,"An ethereal, detailed close-up of a woman with an ice crown, gazing directly at the viewer."
869f7dd299239fb2381c4d93a7fa7883.png,"An ethereal woman, crowned in white flowers and blue gems, floats in a deep blue realm."
70f730ffceb7880d002c1d7da485e48b.png,"A serene fantasy realm: majestic creature of myth, a marble giant with antlers, dominates a peaceful landscape."
1fbc917c04ef7fea46b9c37400a3c999.png,"A studio portrait: Blue-themed makeup, elegant updo, sparkling crystal dress."
cc8dd657d12c7f2542920eefefde76f8.png,A surrealistic fusion: Octopi embrace a docked ship amidst snowy peaks.
be4f51f5764c7197ade69e26ba599ba9.png,A striking blue and silver makeup portrait.
b580c95d5090ca0537329d9f96648873.png,"A futuristic character, a mysterious portal on his suit, in a desolate environment."
ddf566f6e774c76e3a0254268e94ed45.png,"An ethereal Eiffel, blooming with pink cherry blossoms, contrasts stark white and steel gray hues."
5f1ca7329f97d6bf9a082c40b4371e7e.png,"An adorable robot stands tall on a sunny London sidewalk, adorned in a red hat and blue body, gazing towards adventure. In the background, the majestic Tower Bridge spans the scene, a testament to London's rich history."
d49e16a7e770929999046d380d9e49f5.png,A futuristic comic book panel featuring a cool cat on a skateboard.
76c1a1bf64ca1344ad93b81e49f947c3.png,"A kimono-clad cat, poised and elegant, sits centered amidst a neutral backdrop, exuding East Asian ambiance."
c61afa6ab03a8d608bd8c80fca05827b.png,"An futuristic cityscape: a white, blue, and green metropolis with harmonious, intricate buildings and an ethereal atmosphere."
f68bb12b317046cb7910a22cbdff6219.png,"An abstract, vibrant painting: Central cloud, symmetrical balance, bold colors."
780710bf1761bf0d59b53eabd3ed87a0.png,"An illustrative portrait of Ara, centered and confident, amidst serene mountains."
cfdf7a2233487844d8a5ffac9eb087ca.png,A bold digital portrait: Blue & orange woman with piercing eyes against a nuanced dark background.
83103730a776f92cfc5eea62f1c71fad.png,"A mysterious digital portrait, the face adorned in a blue and white mask, elegant and intricate."
49a19f263b41b70bc3714cc66595fd5f.png,"A black and blue dragon, wings folded, sits on a rock against a dark gray background."
01d9e9a3c841bde1c64cb780ab9ecaaa.png,"An ethereal, lunar-toned illustration, centered around a blue bear standing erect on rippling water."
fe98b8eb0443a028508d1c5c76285a08.png,"A moody, close-up oil painting of Batman, his face partially hidden by rain-soaked mask."
59b8632d51cc5eed87f3d90bb7411ea0.png,"A captivating portrait: Elegant woman in black with a perched bird, DHL backdrop."
56dc27711686bd35f7c0e84ef324636c.png,"A fantastical portrait: Woman with jewel-crowned hair, floating in a blue bubble realm."
7b7ccc86b78c446badbf94b79cdb684a.png,"A surreal scene: two monsters, a woman, and a flying bird."
e5a471210dad5b649bfa9f26b7d935da.png,"An ethereal, futuristic female figure poised against a serene celestial canvas."
824cf688c5ff636bd7ecc610cbec8b5e.png,"A bold, enigmatic portrait: A red-haired woman with a mysterious tattooed face, vivid green eyes, and fantastical hair, against a dark, shaded background."
c82fac07c1000d5740c8c687d6aea705.png,"An ethereal, starry night featuring a chic, curled woman adorned in black with a flock of birds, merging traditional art with modern design."
f6da3937a9590c715205ab1ed3c8f73d.png,"A futuristic figure in a robe, masked, holds a device, gazing upon a bustling cityscape, a fusion of ornate architecture."
022017255da506fd526a9c2b9ff0f35f.png,"A bold digital portrait: Futuristic African Queen, majestic, determined. Her intricate gold & black attire, and warm orange backdrop."
09efbd5d7f29d8ca1a70d44bb559851e.png,"A striking close-up of a curious dog, its inquisitive gaze capturing the essence of the image."
a15b07708972f46c98a98efc34acd56c.png,"An orange-hued sunset landscape with a prominent rock, topped by a solitary white toilet paper roll, and a distant mountain range."
a684b4e01a2b2c1a54754010a9543aaa.png,A haunting digital artwork: a menacing skull adorned with horns amidst a vibrant rose garden.
510dfe35f5bf2188ac55c59d9d7c9730.png,"An epic, striped space odyssey."
bb3ba10d6cf74832b1a310cf4d4f9aef.png,"An otherworldly landscape with rocky foreground, vast space, and multiple planets dotting the sky, inviting exploration."
9d1ba74a222a245f81330c96fe70f926.png,"A colorful cartoon princess, seated on a blank canvas, holding a pencil."
28f0fa2712a2aac464747cf0d767d9d5.png,"An orange-hued spaceship interior with a controlled chaos of gadgets, a cozy bed, and a harmonious color scheme."
e1cb51d145a6998e535630ff7ecb2395.png,"A sepia-toned photograph of two women, intimate and connected, illuminated by soft light, showcasing camaraderie through their angled poses and symmetrical outfits."
23a46874189085ca9370deee9b342ce1.png,"A chaotic medieval battle, a silver and gold army led by a roaring, armored warrior."
aa7b4e3eab2684256ff677a6dc58fe68.png,"An ethereal double portal, two paths revealed, figures stand at its gateway."
7bc2701c4de36067c735f430e66ec4ca.png,A brown canine-turtle hybrid with a captivating gaze on a black background.
17ec9aa4f0b9f0cbd11e3f40c190a6a4.png,"An ethereal, surreal painting: A meditating figure's silhouette, surrounded by a complex aura under a starry sky."
aea9ac6777d4ac0170eb36de9ead18ed.png,"A vibrant, starry creature with a large head, wearing a spiral hat and holding a trophy and key, set against a dark background."
b4bb130c4146e6bb6eb9d13462eb910d.png,"A 3D stylized black dog, curious and playful, with geometric shapes and big, expressive eyes, set against a light blue background, inviting a warm and joyful mood."
8ce2b6111f9dff36f20d61199e695486.png,"A black background highlights a regal woman in a blue and gold gown, centered and crowned with a unique hairstyle."
0f796e1f2b121323a19ef8a5e50effc7.png,"A brooding anime character poised in an enigmatic composition, their vibrant orange eyes contrasting a dark backdrop, adorned with a stylish black hat and cloak."
f4e655126b6adafc3e429481faa07ad7.png,"""An elegant woman in a pink dress, adorned with a whimsical floral updo, sits amidst a well-set table."""
9d1fb2bcb7314cb3b3b16d66f6a4106d.png,"An orange-hued digital illustration of a woman on a ship's deck, adorned with a perched bird, exudes serenity."
ce5eaa0ca03413ce9571894fbe1c3d70.png,"A vibrant wolf's head, blue-purple hues harmonize."
3be4d13563bb205b91110fd03b492529.png,"An animated triptych of fashionable feline adventurers, ready to embark on a vibrant journey."
6405de8a46fc5a40a5686b8cb755f6b9.png,"A purple-hued, symmetrical mushroom cluster, lit dramatically."
9bf35cad96b26b84d676835faffde79a.png,"An elevated, contemporary cliffside abode overlooking a serene ocean vista."
4fd0a3374bb1205928d69240b0ccded8.png,"An ominous urban apocalypse depicts a disheveled man, clad in a bloodied coat, standing resolute amidst chaos."
9e09049ab6b0419903266f62b36fabc9.png,"A detailed, vibrant illustration of a snake nestled in a lush tropical rainforest with orange-hued eyes, surrounded by green foliage."
98a618fabae98a4fb438b1fda3ec8018.png,"A majestic lion crowned in gold, a symbol of strength."
dc0b7a07650e8fffa83eb63858ab689d.png,A digital illustration of an enigmatic alien creature.
543e8f7cc261ba7c6935ad710fa4a0bb.png,"A futuristic portrait: Woman in an astronaut suit, bold & mysterious."
a55a5358aa54e3ec6403f062567c30b3.png,"An ethereal, serene sunset vista: a majestic green castle, intricate & tall, with warm accents."
b04b1b86c3ae5c44140aa2f848c7a698.png,"An epic illustration depicting a wise wizard, focused and enigmatic, prepared for a quest."
8800108ec0f256a1a1aea7f3de4adfc8.png,"An ethereal sunset landscape: Vibrant wildflower field, lone tree, mountain range, and a serene sky full of warm hues."
b3575375af5d3de8c2028fb8efe9c2da.png,"A neon-lit mushroom forest, dynamic and futuristic."
2fc1a6a2b8125ed6e058f17ccca6bf9f.png,"An ethereal, futuristic bedroom with a striking neon glow, balanced composition."
61669e5fc45264a3cdd1f92e996fa5af.png,"A surreal library filled with lost knowledge; a tall enigmatic figure, dressed in white, holds a book, inviting us with its intense gaze."
5d7cc9e5df62180507ef86e50d2fd8dd.png,"A white background showcases two figures, each wearing green outfits and orange ponytails."
10547cc3234fed602b9d62cbad520c18.png,"An ethereal, fairy-like scene: Red and white spotted mushrooms among gray rocks with bubble details."
c5707b9881b7abe2560842e8c21b3198.png,"A serene oil painting: radiant storm clouds above, calm waters below."
ff2f7acf8f89357c92ab85ff66891ba7.png,"A serene forest refuge, a sleek black muscle car with vibrant green accents glows in dappled light."
b1f6a91373482cceed3c9d296614278e.png,"An intricate robot with a multitude of eyes and wires, set against a blue gradient."
60d79892686981516bcff34c71335aca.png,"An elegant green bottle with gold accents, luxurious detail, against a black backdrop."
034d082e1cdb9cb9577d7e3e9aea91f5.png,"An otherworldly, starry garden with striped planets, lush greenery, and splashes of orange amidst a dark blue sky."
64d968250c2defa132b82735f3829f9f.png,"An orange-hued sketch of a woman adorned, flanked by Japanese mythological creatures, inviting viewers into her mysterious world."
24c4efcf914795b17a342a7f97402dd2.png,"A futuristic blue-tinted portrait, a woman adorned in dark hair with elegant jewelry set against a geometric background."
ec44642a3f354d5131f1d665b360c274.png,"A confident woman in green, centered, stands out against an industrial backdrop."
1d9536956d28a97ea437e0a99beb3557.png,"A cozy breakfast still life: Plate with egg, toast, mushrooms, wooden tones."
21b979d2ff7393310a234dd6efaec023.png,"An orange and blue digital piece: a lone explorer stands on a starry, rocky planet, gazing into the vastness of space."
02c86bc993642b198dd28a27e279b9e8.png,"An anime girl in a red kimono, surrounded by cherry blossoms, and warm lanterns, gazes at the viewer with a gentle smile."
8edb7b98f9731c8370e1961ffa35d275.png,"A Yorkie's portrait set before a galaxy, its blue eyes fixed on stars, playful and upright."
daff8fbdced549863ae6972ae695e32f.png,"A tempting breakfast still life: egg, coffee, toast, and jam."
71358c3515b87c822650b0cd36a63402.png,"An inviting, wooden table breakfast scene: Fresh egg, toast, mushrooms, coffee."
0131d7f410904e3553de0274317ac230.png,"A dreamy fox-creature, adorned in orange, sits lost in thought amidst blooming cherry blossoms."
e87f9e596a500501c802786bacb0071f.png,"A close-up portrait, a woman in a green floral swimsuit at the beach."
ae647684a11cb9e23d6ffbcc80cd9804.png,"A portrait of a confident woman with blue hair, wooden door backdrop."
3650143a7e916de3a2a3da97ae9ca366.png,"An ethereal, dark digital illustration: A black cat, orange flames enveloping it, gazes intently into the distance."
8d1f9a0b8c513c58d2a9a990a2469c70.png,A futuristic portrait: A serious blonde woman in a sleek black suit pausing amidst cosmic hues.
b1ae645b1c0b95345aaf6e0fad1fcb9f.png,"A studio portrait of a young woman in a vibrant red dress, beaming with a confident smile."
42bd84f5ef4900a487782237ec049095.png,An enchanting autumnal scene: a cheerful girl amidst a sea of yellow leaves.
8831686f4736d7fa9d6e7d1132318b66.png,"A grand royal portrait, featuring a woman with blonde hair, blue eyes, and intricate gold detailing."
7f9d9c7ec432ef0327dcfd97d70f4b7d.png,"A vibrant, fiery phoenix illustration with a majestic pose and rich colors."
ca822953644c4eb0b38770d428e494a5.png,An up-close oil painting of a video game character figurine in a peaceful garden.
f415091eb6ab87b0d99a916ae29a5846.png,"A whimsical crowned fox with feathered wings, seated on wood amidst autumnal leaves, amidst a soft orange and blue blur."
cf4bf3a3d188f5eb81ae995f24919612.png,"An endearing cartoon raccoon, upright and pleading, on a gray background."
ae482c94be33884e0077b493c6563c4a.png,A colorful cartoon turtle illustration with vibrant bubbles amidst a neutral background.
a364f524be884521caced53466ae9821.png,"A detailed, colorful portrait of a beaded, feathered woman gazing at the viewer."
d2356157e89afe21f3f21624ca8e175c.png,"An ethereal, elderly figure standing in an enchanted forest."
d73947a11ed0822a694e6d688b60a8dd.png,"An egg-shaped kaleidoscope of vibrant colors in motion, surrounded by playful objects, against a dark background."
b03ac1e4a00067f675c1d6b3a2176de5.png,"A studio portrait: Serious redhead in front of dark gray, focused, elegant."
c4377e9f775a8d9a0af2089479a58832.png,"An eerie tree-being, faceless yet expressive, stands amidst a fantasy forest."
907084e11d1de394afc8bc98027ff328.png,"An intimate digital portrait of two seniors enjoying a meal, a splash of vibrant colors, and a furry friend."
6ad654f934236080437d75a48bcc7925.png,"An illustration featuring a cute hedgehog sitting on a table amidst colorful objects, exuding whimsy."
5ee24aba649373e3a7cf26002f801f87.png,"""A futuristic train car's symmetrical interior, a green and orange haven with a central figure gazing out at nature's reach."""
0e0e30d8db28eab4360e3d3e70b11a19.png,"A dramatic portrait: a woman adorned with a intricate green and gold headdress, her intense gaze meets ours."
e1ab25e8abb88a6dc27cdf9239067566.png,"An ancient, carved stone temple hidden in an overgrown jungle, peaceful and abandoned."
5798e28338ce0ef78bfe052c48515846.png,"A serene oil painting of a white cat with piercing orange eyes, adorned in gold and pink, gazing at the viewer."
c5e704d251867ce5722f19effb2dad50.png,"A warm, inviting classroom: Teacher in white shirt, student in anticipation, against a board of notes."
e65070decb2ed965572364f11e656022.png,"""An oil painting of three unique roses in close-up, blurred gradient backdrop."""
145513c3ac899503fab8ce4d3df147ef.png,"A serene close-up of a woman with captivating eyes gazing directly, surrounded by radiant light."
3a1f29c35bc620b693747dd3447f8add.png,"A boy, lit by jar's orange glow, stands in a surreal fiery landscape."
7f4866867968bd6b8f1582923c48165c.png,"A detailed, silver and white tree on a deep red background, circular composition."
6190ebcff29c0ca37e2fddf5705f35e9.png,"A studio portrait: Captivating, warm-lit close-up of a young woman's face."
ac6c8dd144fe72fc65dc9214a311edd1.png,"A black and white dog's introspective moment, seated in front of a round mirror, capturing its curious reflection."
e9ab1099c46b6d295f9897d03c2c236f.png,"A majestic elephant's portrait: Regal, adorned, monochrome, ceremony."
8544288e913387b2b5a1839c1c5e17c2.png,"An ethereal oil painting of a black bear cub, crowned in a vibrant floral wreath, amidst a serene white backdrop."
84b074cc5d5279119c49ec6955481262.png,"An illustration of a vibrant mushroom forest with diverse shapes and hues, set in a serene, neutral backdrop."
6e9c00ee1e86b6b195803517f0fe5330.png,A close-up of a creature's face with green eyes against a black background.
adac7e9ca9773e3fd806017f807297df.png,A thought-provoking digital artwork: a realistic blue eye surrounded by melting continents.
7110041ae64fa901badcac75c1fd6087.png,"An ethereal, futuristic monarch: a blue-skinned woman, adorned in black and silver, sits upon a curved, gleaming throne, inviting intrigue."
149cfe50f4375438bccb44f81eb2bdda.png,"A majestic, gilded portrait: a bearded man, crowned, adorned, mysterious."
2791264b9e40e27e97c9b0ca354a60f3.png,"A whimsical cat wizard with a tilted hat, seated in a dark chamber, gazes directly at the viewer."
dd1df1bd65749e54d7b517fe4aaeb7d2.png,"A digital illustration of a wise cat, a furry intellectual in a library."
24def163de19d588f520387b140945a3.png,"A majestic digital portrait: Armed woman in black armor, elegant, powerful, regally poised, fills the frame."
